,genre,storyline,title
427,Comedy Music,"The up-and-down-and-up-again story of musician Dewey Cox, whose songs would change a nation. On his rock 'n roll spiral, Cox sleeps with 411 women, marries three times, has 36 kids, stars in his own 70s TV show, collects friends ranging from Elvis to the Beatles to a chimp, and gets addicted to - and then kicks - every drug known to man; but despite it all, Cox grows into a national icon and eventually earns the love of a good woman - longtime backup singer Darlene.",Walk Hard: The Dewey Cox Story
428,Adventure Comedy Music,"This is the story of a friendship that changes the course of rock history forever, of the fateful collision of minds between JB and KG that led to the creation of the precedent-shattering band Tenacious D, and of the two heroes' quest to find the fabled Guitar Pick Of Destiny...",Tenacious D in The Pick of Destiny
429,Comedy Music Romance,"Robbie Hart is singing the hits of the 1980s at weddings and other celebrations. He also can keep the party going in good spirit, he knows what to say and when to say it. Julia is a waitress at the events where Robbie performs. When both of them find someone to marry and prepare for their weddings, it becomes clear that they've chosen wrong partners.",Luda vjenčanja
430,Animation Adventure Comedy,"Our intrepid adolescent heroes wake up to find their beloved television stolen, and embark on an epic journey across America to recover it, and, who knows, maybe even score. On the way they encounter a murderous smuggler of a deadly virus and his treacherous wife, an FBI agent with a predilection for cavity searches, a couple of rather familiar looking ex-Motley Crue roadies, Mr. Van Dreesen singing ""Lesbian Seagull"", a little old lady and of course Mr. Anderson and his trailer. Can the Great Cornholio save the day? Uh-huh. Huh-huh.",Beavis and Butt-Head Do America
431,Drama Music,"Nineteen-year-old Brooklyn native Tony Manero lives for Saturday nights at the local disco, where he's king of the club, thanks to his stylish moves on the dance floor. But outside of the club, things don't look so rosy. At home, Tony fights constantly with his father and has to compete with his family's starry-eyed view of his older brother, a priest. Nor can he find satisfaction at his dead-end job at a small paint store. However, things begin to change when he spies Stephanie Mangano in the disco and starts training with her for the club's dance competition. Stephanie dreams of the world beyond Brooklyn, and her plans to move to Manhattan just over the bridge soon change Tony's life forever.",Groznica subotnje večeri
432,Comedy Music,"When his new album fails to sell records, pop/rap superstar conner4real goes into a major tailspin and watches his celebrity high life begin to collapse. He'll try anything to bounce back, anything except reuniting with his old rap group The Style Boyz.",Popstar: Never Stop Never Stopping
433,Biography Comedy Drama,A man working at his parents' motel in the Catskills inadvertently sets in motion the generation-defining concert in the summer of 1969.,Svi na Woodstock
434,Comedy Drama Music,"It's been three weeks, two days, and 23 hours since Tris broke up with Nick. And now here she is at his gig, with a new guy. How could she have moved on so fast? This begins the night of Nick, Norah and Manhattan. The night of stripping nuns, hotel ice rooms, Russian food, psychotic ex-boyfriends and lovingly trashy ex-girlfriends. It's the night of Julio and Salvatore. The night of holding hands and writing songs and singing in the rain. It's a night they'll never forget.",Nick i Norah: Spoj za jednu noć
435,Biography Drama Music,"In 2005, the only thing hurting Los Angeles Times columnist Steve Lopez more than his face from a recent bike accident was his pressing need for story ideas. That is when he discovers Nathaniel Ayers, a mentally ill, homeless street musician who possesses extraordinary talent, even through his half-broken instruments. Inspired by his story, Lopez writes an acclaimed series of articles about Ayers and attempts to do more to help both him and the rest of the underclass of LA have a better life. However, Lopez's good intentions run headlong in the hard realities of the strength of Ayers' personal demons and the larger social injustices facing the homeless. Regardless, Lopez and Ayers must find a way to conquer their deepest anxieties and frustrations to hope for a brighter future for both of them.",The Soloist
436,Biography Crime Drama,"NOTORIOUS is the story of Christopher Wallace. Through raw talent and sheer determination, Wallace transforms himself from Brooklyn street hustler (once selling crack to pregnant women) to one of the greatest rappers of all time; THE NOTORIOUS B.I.G. Follow his meteoric rise to fame and his refusal to succumb to expectations - redefining our notion of ""The American Dream.""",Notorious
437,Comedy Drama Music,"A day in the life of the employees of Empire Records. Except this is a day where everything comes to a head for a number of them facing personal crises - can they pull through together? And more importantly, can they keep their record store independent and not swallowed up by corporate greed?",Empire Records
438,Biography Drama Music,"In 1975, San Fernando Valley teen Joan Larkin reinvents herself as Joan Jett, a guitarist who wants to form an all-girl punk band. She pitches the idea to a sleazy manager, Kim Fowley, who pairs her with a drummer and then searches for a face: he finds Cherie Currie, at age 15, the perfect jailbait image for his purpose; by luck, she can sing. Two others round out the band, The Runaways. Fowley books a tour, signs them to Mercury Records, and packs them off to crowds in Japan. Seeds of conflict sprout early: Fowley puts Cherie front and center in the publicity, she's soon strung out on drugs and vodka, and jealousies arise. Without adult supervision, where can Joan and Cherie end up?",Runaways
439,Crime Drama Music,"In Baltimore, the troublemaker and street dancer Tyler Gage lives with his foster parents in a lower class neighborhood. His best friends are Mac Carter and his little brother Skinny Carter and they used to hang around together, going to parties and stealing cars. After being expelled from a party, the trio breaks in the Maryland School of Arts and commits vandalism, destroying the stage. Tyler is arrested and sentenced to 200 hours of community service in the school and Director Gordon assigns him to help the janitor cleaning the place. One afternoon, the ballet dancer Nora Clark sees Tyler dancing in the parking area and when her partner Andrew has a strain and Tyler offers to help her in the choreography, she accepts the offer; they rehearsal and become close to each other while Tyler becomes friend of the students Miles Darby and Lucy Avila. When Andrew returns, Tyler that is known for quitting everything he starts gives up dancing and leaves Nora alone. After an incident, Tyler ...",Step Up
440,Drama Music Romance,"The Mob sets the dancing against the vibrant backdrop of Miami. Emily arrives in Miami with aspirations of becoming a professional dancer and soon falls in love with Sean, a young man who leads a dance crew in elaborate, cutting-edge flash mobs, called ""The Mob"". When a wealthy business man threatens to develop The Mob's historic neighborhood and displace thousands-of people, Emily must work together with Sean and The Mob to turn their performance art into protest art, and risk losing their dreams to fight for a greater cause.",Step Up 4
441,Comedy Music Romance,"Cheery Alex Fletcher lives comfortably in Manhattan off the residuals from his 80's pop success and reprising his hits at school reunions, theme parks, and state fairs. But those gigs are declining, so he jumps at the chance to write a song and record it with reigning teen idol Cora Corman. Trouble is, he's good at melodies but needs a lyricist and has less than a week to finish. Enter Sophie Fisher, subbing for a friend who waters Alex's plants; she's a pretty good poet, quick witted, and could do it, if she'd agree. But there's some sort of shadow over her head that Alex may not be able to charm his way past. And what if they do get a song written, what then?",Glazba i stihovi
442,Drama Music Musical,"Detroit, the early 1960s. Curtis Taylor, Jr., a car salesman, breaks into the music business with big dreams. He signs a trio of young women, the Dreamettes, gets them a job backing an R&B performer, James ""Thunder"" Early, establishes his own record label and starts wheeling and dealing. When Early flames out, Curtis makes the Dreamettes into headliners as the Dreams, but not before demoting their hefty big-voiced lead singer, Effie White, and putting the softer-voiced looker, Deena Jones, in front. Soon after, he fires Effie, sends her into a life of proud poverty, and takes Deena and the Dreams to the top. How long can Curtis stay there, and will Effie ever get her due?",Dreamgirls
443,Animation Adventure Comedy,"This is the story of a little penguin named Mumble who has a terrible singing voice and later discovers he has no Heartsong. However, Mumble has an astute talent for something that none of the penguins had ever seen before: tap dancing. Though Mumble's mom, Norma Jean, thinks this little habit is cute, his dad, Memphis, says it ""just ain't penguin."" Besides, they both know that, without a Heartsong, Mumble may never find true love. As fate would have it, his one friend, Gloria, happens to be the best singer around. Mumble and Gloria have a connection from the moment they hatch, but she struggles with his strange ""hippity- hoppity"" ways. Mumble is just too different--especially for Noah the Elder, the stern leader of Emperor Land, who ultimately casts him out of the community. Away from home for the first time, Mumble meets a posse of decidedly un-Emperor-like penguins--the Adelie Amigos. Led by Ramon, the Adelies instantly embrace Mumble's cool dance moves and invite him to party with...",Ples malog pingvina
444,Drama Music Romance,"Classic tale of teenage rebellion and repression features a delightful combination of dance choreography and realistic and touching performances. When teenager Ren McCormack and his family move from big-city Chicago to a small Midwestern town, he's in for a real case of culture shock. Though he tries hard to fit in, the streetwise Ren can't quite believe he's living in a place where rock music and dancing are illegal. However, there is one small pleasure: Ariel Moore, a troubled but lovely blonde with a jealous boyfriend. And a Bible-thumping minister, who is responsible for keeping the town dance-free. Ren and his classmates want to do away with this ordinance, especially since the senior prom is around the corner, but only Ren has the courage to initiate a battle to abolish the outmoded ban and revitalize the spirit of the repressed townspeople. Fast-paced drama is filled with such now-famous hit songs as the title track and ""Let's Hear It for the Boy"".",Footloose
445,Comedy Music,"The Bellas are back, and they are better than ever. After being humiliated in front of none other than the President of the United States of America, the Bellas are taken out of the Aca-Circuit. In order to clear their name and regain their status, the Bellas take on a seemingly impossible task: winning an International competition no American team has ever won. In order to accomplish this monumental task, they need to strengthen the bonds of friendship and sisterhood, and blow away the competition with their amazing aca-magic! With all new friends and old rivals tagging along for the trip, the Bellas can hopefully accomplish their dreams once again.",Na putu do zvijezda 2
446,Adventure Comedy Music,"English rock star Aldous Snow relapses into drugs and booze after a break up and a disastrous record. In L.A., Aaron Green works for a record company stuck in recession. Aaron's boss gives him a career making task - to bring Aldous from London to L.A. for a concert in 72 hours. That day, Aaron's girlfriend Daphne tells him she wants to finish her medical residency in Seattle. Aaron's sure this ends their relationship. In London, things aren't much better: Aldous delays their departure several times, plies Aaron with vices, and alternates between bad behavior and trenchant observations. Can Aaron moderate Aldous's substance abuse and get him to the Greek? What about Daphne?",To je rock'n'roll!
447,Drama Music Musical,"The Burlesque Lounge has its best days behind it. Tess, a retired dancer and owner of the venue, struggles to keep the aging theater alive, facing all kinds of financial and artistic challenges. With the Lounge's troupe members becoming increasingly distracted by personal problems and a threat coming from a wealthy businessman's quest to buy the spot from Tess, the good fortune seems to have abandoned the club altogether. Meanwhile, the life of Ali, a small-town girl from Iowa, is about to change dramatically. Hired by Tess as a waitress at the Lounge, Ali escapes a hollow past and quickly falls in love with the art of burlesque. Backed by newfound friends amongst the theater's crew, she manages to fulfill her dreams of being on stage herself. Things take a dramatic turn though when Ali's big voice makes her become the main attraction of the revue.",Burleska
448,Comedy Crime Family,"Deloris Wilson, a black woman who has chosen the stage name Deloris Van Cartier, is a Reno lounge singer, she the lead in a girl trio in which she also chooses and arranges the music and choreographs the shows. She is a wisecracking, showy woman who has always loved music. She, however, only has her current job being hired by her married lover, Vince LaRocca, to sing in his casino's lounge. She learns of Vince's true business as a gangster when she walks in on him killing one of his employees who wronged him. As a witness to the murder, Deloris goes on the run to the police, Lt. Eddie Souther who has long been running an operation to get enough evidence to put Vince behind bars, this murder which could be the proverbial nail in Vince's coffin. However, Vince has put a contract out on Deloris' life to prevent her from testifying against him. As such, Eddie has to hide her until the trial, which will be at least two months. Where Eddie chooses is St. Katherine's, a poor Catholic parish ...",Redovnice nastupaju
449,Comedy Music Romance,"In Rome, the America tourist Hayley meets the local lawyer Michelangelo on the street and soon they fall in love with each other. Hayley's parents, the psychiatrist Phyllis and the retired music producer Jerry, travel to Rome to meet Michelangelo and his parents. When Jerry listens to Michelangelo's father Giancarlo singing opera in the shower, he is convinced that he is a talented opera singer. But there is a problem: Giancarlo can only sing in the shower. The couple Antonio and Milly travel to Rome to meet Antonio's relatives that belong to the high society. Milly goes to the hairdresser while Antonio waits for her in the room. Milly gets lost in Rome and the prostitute Anna mistakenly goes to Antonio's room. Out of the blue, his relatives arrive in the room and they believe Anna is Antonio's wife. Meanwhile the shy Milly meets her favorite actor Luca Salta (Antonio Albanese) and goes to his hotel room ""to discuss about movies"". One day, the middle-class clerk Leopoldo becomes a ...","Rimu, s ljubavlju"
450,Drama Music Romance,"Following the death of her parents, teen-aged Andie West is living with her mother's best friend, Sarah. Andie, who doesn't care about school, is trying to figure out where she fits in in life. The only thing she loves is dancing with her street crew, the 410, led by Tuck. The 410 are the most notorious of the street crews in Baltimore and are wanted by the police for their acts of vandalism and public mischief. Sarah threatens to send Andie to live with relatives in Texas unless she cleans up her act, which includes ending her association with the 410 and trying harder at school. Andie's neighborhood friend, Tyler Gage, convinces Andie to audition for entry into the Maryland School of the Arts (MSA), an institution which ended up turning his life around for the better. Andie passes the audition but isn't sure she fits in there. The school's director, Blake Collins, isn't sure she fits in there either. Blake is a brilliant dancer but looks for conformity to his way. After learning ...",Step Up 2
451,Comedy Drama Music,"Hail Caesar! Follows a day in the life of Eddie Mannix, a Hollywood fixer for Capitol Pictures in the 1950s, who cleans up and solves problems for big names and stars in the industry. But when studio star Baird Whitlock disappears, Mannix has to deal with more than just the fix.","Ave, Cezare!"
452,Drama Music,"Chris Cole was born to rock. His longtime girlfriend Emily believes his talent could take him all the way - but Chris worships at the altar of Bobby Beers, the fiery frontman for heavy metal legends Steel Dragon. By day, Chris still lives at home with his parents and spends his days repairing copy machines. But when Chris takes the stage, fronting Pennsylvania's premiere Steel Dragon tribute band, all of that disappears. Chris Cole is Bobby Beers - mesmerizing audiences with his perfect imitation of Beers' electrifying vocals. The night his bandmates boot him out of the group, Chris is devastated - until an unexpected phone call changes his life forever: He, Chris Cole, has been tapped to replace Bobby Beers as the lead singer of Steel Dragon. In an instant, Chris rockets to the dizzying heights of sudden stardom, rising from devotee to icon, from rock fan to rock god - the wanna-be who got to be. So what happens when an average guy gets everything he wants - and discovers it's not ...",Rock Star
453,Adventure Comedy Fantasy,"The world of our distant future is a veritable utopia, thanks to the lyrics of two simple-minded 20th Century rock and rollers, Bill S. Preston, Esq. and Ted ""Theodore"" Logan. However, a would-be conquerer threatens to throw history off-track by sending ""most non-non-heinous"" evil robot Bill and Teds back to kill their good counterparts. Finding themselves dead, the boys must outwit the Grim Reaper and traverse Heaven and Hell to return to the land of the living, rescue their ""babes"" and have a ""most triumphant"" concert at the all-important Battle of the Bands.",Bill & Ted's Bogus Journey
454,Drama Music Romance,"Cole is an aspiring DJ who spends his days scheming with his childhood friends and his nights working on the one track that will set the world on fire. All of this changes when he meets a charismatic but damaged older DJ named James, who takes him under his wing. Things get complicated, however, when Cole starts falling for James' much younger girlfriend, Sophie. With Cole's forbidden relationship intensifying and his friendships unraveling, he must choose between love, loyalty, and the future he is destined for.",We Are Your Friends
455,Drama Music Romance,"A tight-knit group of New York City street dancers, including Luke (Malambri) and Natalie (Vinson), team up with NYU freshman Moose (Sevani), and find themselves pitted against the world's best hip hop dancers in a high-stakes showdown that will change their lives forever.",Step Up 3D
456,Comedy Music,"The Rocker tells the story of a failed drummer who is given a second chance at fame. Robert ""Fish"" Fishman is the extremely dedicated and astoundingly passionate drummer for the eighties hair band Vesuvius, who is living the rock n' roll dream until he is unceremoniously kicked out of the band. Twenty years after his rock star fantasies are destroyed, just when Fish has finally given up all hope, he hears that his nephew's high school rock band A.D.D. is looking for a new drummer. They reluctantly make him the newest member of the band, giving him a chance to reclaim the rock god throne he always thought he deserved, and taking the young band along for the ride of their lives.",The Rocker
457,Comedy Family Fantasy,"The wide generation gap between Tess Coleman and her teenage daughter Anna is more than evident. They simply cannot understand each other's preferences. On a Thursday night they have a big argument in a Chinese restaurant. Both receive a fortune cookie each from the restaurant owner's mother which causes them to switch bodies next day. As they adjust with their new personalities, they begin to understand each other more and eventually it's the mutual self-respect that sorts the things out.",Šašavi petak
458,Drama Music Romance,"Sara wants to be a ballerina, but her dreams are cut short by the sudden death of her mother. She moves in with her father, who she has not seen for a long time. He lives on the other side of town, in a predominantly Black neighborhood. She gets transferred to a new school where she is one of the few White students there. She becomes friends with Chenille, and later, falls in love with Chenille's brother, Derek.",Plešimo zajedno
459,Comedy Music Romance,"The Roxbury Guys, Steve and Doug Butabi, want to get into the best club in town, and also hope to open their own club. Vivica, a gold-digging supermodel, and her friend Cambi try to work the Roxbury Guys for their money, only to find out the pair is broke.",Prave face
460,Comedy Music,"Wayne is back, this time trying to organize a rock festival with help from friend Garth and the spirit of Jim Morrison (Doors). Meanwhile, his girlfriend's manager is busy trying to woo her away from Wayne and move her to LA. Life gets interesting when Wayne must rush from the concert to try and stop the wedding. Aerosmith are featured at the concert.",Wayneov svijet 2
461,Drama Music Romance,"A pop singer has been receiving threatening notes, and her manager hires a bodyguard known for his good work. The bodyguard ruffles the singer's feathers and most of her entourage by tightening security more than they feel is necessary. The bodyguard is haunted by the fact that he was on Reagan's secret service staff but wasn't there to prevent the attack by Hinckley. Eventually the bodyguard and the singer start an affair, and she begins to believe his precautions are necessary when the stalker strikes close to home.",Tjelohranitelj
462,Drama Music Romance,"Alex Owens is a female dynamo: steel worker by day, exotic dancer by night. Her dream is to get into a real dance company, though, and with encouragement from her boss/boyfriend, she may get her chance. The city of Pittsburgh co-stars. What a feeling!",Flashdance
463,Comedy Drama Music,"John Clark is a middle aged Chicago estate lawyer. He loves his family, which includes his wife Beverly, but their combined busy schedules and getting caught in a rut after two decades of marriage has left him feeling unfulfilled. While taking the el train home every night, he notices the same young, beautiful contemplative woman staring out of one of the windows of Miss Mitzi's Dance Studio, which specializes in ballroom. He is intrigued enough with her beauty and sadness to go in one evening on his way home. He learns that she is Paulina, one of the instructors and a former world class ballroom dancer. Because of her, he signs up for beginner group dance lessons, regardless of them being taught by Miss Mitzi herself, and not Paulina. As time progresses, John gets caught up in the lives of those at Miss Mitzi's: his two fellow classmates - overweight Vern who wants to learn to dance for his upcoming wedding, and Chic, who wants to impress the ladies - and two of the studio's ...",Jeste li za ples?
464,Comedy Crime Music,"Three would be rockers Chazz, Rex and Pip, known as The Lone Rangers plan to play their demo on a recording company, but then they're turned down rudely. Then they decide to try the famous rock n' roll radio station, but are not accepted either. Then they decide arm themselves with squirt guns and take the station hostage for not playing their demo. But the three get more than what they have bargained for.",Airheads
465,Action Comedy Crime,"All Tess Trueheart wants is to settle down to a quiet life with her boyfriend, detective Dick Tracy. But there's something pretty rotten going on in town, with someone pretty rotten behind it, and Tracy has his hands full with the likes of villain Big Boy Caprice and with the almost irresistible Breathless Mahoney.",Dick Tracy
466,Drama Music Romance,"Sean brings his dance crew known as The Mob to Los Angeles to try and make it. But they haven't had much luck, eventually the Mob decides it's time to go back to Miami but Sean decides to stay. He learns of a dance competition is Las Vegas wherein the winner will get a three year contract. Sean needs a new crew so he asks fellow dancer Moose for help. And Moose introduces him to Andie, another friend and dancer who got injured a few years ago and is now ready to get back in. He recruits some other friends and they head Las Vegas as LMNTRIX. When they get there, they discover that the Mob too is also there, which is very touchy for Sean.",Step Up All In
467,Drama Music Romance,"Ronnie's (Miley Cyrus) and her younger brother, Jonah's, parents are divorced. They live with their mother until this summer when they are sent to live with their father (Greg Kinnear) in a small town on the beach. Ronnie resents her father and has no intention of being friendly or even talking to him for the summer. But after meeting a handsome guy and beginning to fall in love, Ronnie starts rediscovering her love for music, something she shares with her father. Reconnecting with music revives a kinship with her father which proves to be the most important relationship she may ever experience.",The Last Song
