,genre,storyline,title
511,Comedy Fantasy Romance,"It's a world where everyone tells the truth - and just about anything they're thinking. Mark Bellison is a screenwriter, about to be fired. He's short and chunky with a flat nose - a genetic setup that means he won't get to first base with Anna, the woman he loves. At a bank, on the spur of the moment he blurts out a fib, with eye-popping results. Then, when his mother's on her deathbed, frightened of the eternal void awaiting her, Mark invents fiction. The hospital staff overhear his description of Heaven, believe every word, and tell others. Soon Mark is a prophet, his first inventive screenplay makes him rich, and he's basically a good guy. But will that be enough for Anna?",The Invention of Lying
512,Comedy Drama Romance,"The needy Gigi Haim is a young woman seeking her prince charming somewhere amongst her unsuccessful dates. After dating estate agent Conor Barry, Gigi anxiously expects to receive a phone call from him. However Conor never calls her. Gigi decides to go to the bar where he frequents to see him, but she meets his friend Alex who works there. They become friends and Alex helps Gigi to interpret the subtle signs given out by her dates.",Njemu baš i nije stalo
513,Comedy Romance,"Kirk is an average Joe who works as a TSA agent at the Pittsburgh airport with his friends. The status quo of his fairly monotonous life ends when he meets Molly, a smart, kind and gorgeous blonde. Because she's way out of his league (she's a hard 10 and he is but a 5), Kirk knows there's no way on earth she's ever going to fall for him. Or is there...?",Jednostavno savršena
514,Comedy Musical Romance,"Set on a colorful Greek island, the plot serves as a background for a wealth of ABBA songs. A young woman about to be married discovers that any one of three men could be her father. She invites all three to the wedding without telling her mother, Donna, who was once the lead singer of Donna and the Dynamos. In the meantime, Donna has invited her backup singers, Rosie and Tanya.",Mamma Mia!
515,Biography Comedy Drama,"Sidney Young is a disillusioned intellectual who both adores and despises the world of celebrity, fame and glamor. His alternative magazine, ""Post Modern Review"", pokes fun at the media obsessed stars and bucks trends, and so when Young is offered a job at the diametrically opposed conservative New York based ""Sharps"" magazine it's something of a shock! It seems ""Sharps"" editor Clayton Harding is amused by Young's disruption of a post-BAFTA party with a pig posing as Babe. Thus begins Sidney's descent into success - his gradual move from derided outsider to confidante of starlet Sophie Maes. Initially helping him out at Sharps is colleague Alison Olsen, who has her own secret. Wither their friendship?",Kako izgubiti prijatelje i otuđiti se od ljudi
516,Comedy Romance Sport,"Here's the thing! Viola's soccer team at Cornwall gets cut. She wants to join the boys' team, but they do not allow girls. So she thinks, ""If you can't beat them, join them"". So she does! She disguises herself as her twin brother, Sebastian and goes out for the rival school, Illyria Boys' Soccer Team and makes it. Unfortunately, she didn't plan falling in love with her roommate Duke. But Duke has his eyes on Olivia. What makes matters worse is that Olivia starts to fall for Sebastian because he/she has a sensitive side. If things couldn't get more problematic, the real Sebastian (who was in London working on his music) comes home early. He arrives on campus and has no clue that he was replaced by his twin sister.",Ona je najbolja
517,Biography Drama History,"""All eyes will be on you,"" says the Austrian Empress, Maria Theresa to her youngest daughter Marie Antoinette. The film, marketed for a teen audience, is an impressionistic retelling of Marie Antoinette's life as a young queen in the opulent and eccentric court at Versailles. The film focuses on Marie Antoinette, as she matures from a teenage bride to a young woman and eventual queen of France.",Marija Antoaneta
518,Comedy Drama Fantasy,"Michael Newman (Sandler) is a hard working family man, who must please his boss (Hasselhoff), in order to get promoted. Problem is he gets less time with his family, and wishes for a remote in which he can control his life. This soon comes true for Newman, when he meets Morty (Walken), a crazy sales clerk, who has the ultimate remote. A remote in which he can do anything, including muting, skipping and dubbing his life. He finds this to be the opportunity in which he can not only skip every argument, but also skip to his promotion. He sees this as a good idea, until the remote goes horribly wrong.",Klik - za savršen život
519,Biography Drama History,"In 1660, with the return of Charles II to the English throne, theater, the visual arts, science and sexual promiscuity flourish. Thirteen years later, in the midst of political and economical problems, Charles II orders the return of his friend John Wilmot, aka the second Earl of Rochester, from exile back to London. John is a morally-corrupt drunkard and a debauched, cynical poet. When the King asks John to prepare a play for the French ambassador so as to please him, John meets the aspiring actress Elizabeth Barry in the playhouse and decides to make her into a great star. He falls in love with her and she becomes his mistress. During the presentation to the King and the French ambassador, John falls into disgrace with the court. When he is thirty-three years old and dying of syphilis and alcoholism, he converts to being a religious man.",Libertine - otrov za zene
520,Comedy Drama Romance,"Flor emigrates to Los Angeles from Mexico in hopes of finding a better life for her and her daughter, Cristina. Hired by the John and Deborah Clasky as their housekeeper, Flor contends with the language barrier, Cristina's budding femininity, and the eccentric Clasky's way of life.",Španjolski engleski
521,Comedy Drama Romance,"After causing a loss of almost one billion dollars in his company, the shoe designer Drew Baylor decides to commit suicide. However, in the exact moment of his act of despair, he receives a phone call from his sister telling him that his beloved father had just died in Elizabethtown, and he should bring him back since his mother had problem with the relatives of his father. He travels in an empty red eye flight and meets the attendant Claire Colburn, who changes his view and perspective of life.",Elizabethtown
522,Comedy Romance,"Jerry Falk and David Dobel, who meet at a business meeting, become fast friends. Their commonality is that they are both fledgling New York based comedy writers, largely writing material for stand-ups, are Jewish (although David is an atheist), and are each of bundle of different neuroses. Their big difference is that Jerry is twenty-one, while David is sixty, with forty more years worth of life experience, knowledge and neuroses. While Jerry writes full time - he also working on a novel - David has kept his day job as a public school teacher just in case. In their relationship, David becomes somewhat of Jerry's mentor, providing advice on Jerry's life issues, most which revolve around the fact that Jerry is a product of inertia, he having trouble leaving anyone. That's why Jerry's still with the one and only manager he's ever had, Harvey Wexler. Jerry not only being Harvey's only client (which is a testament to his effectiveness in the job), Harvey also has a 25% take as stipulated ...",Ljubav i sve ostalo
523,Comedy Romance,"In certain circles, Van Wilder is a living legend at Coolidge College, where he's been a student now for seven years, not yet having completed his degree requirements. Despite being bright, he never attends classes anymore, instead hosting parties, imparting his brand of wisdom to his adoring fans, hosting school organization fundraisers, and rallying the college spirit among the student body. Conversely, Van loves his Coolidge life. In his antics, he has a 2ic in Hutch, and always hires a personal assistant, this year's being a South Asian transfer student named Taj, who wants to learn from the best, namely Van. Van's college life is threatened when his wealthy neglectful father only now learns that Van is still in school, Wilder Sr. who has been paying his way all this time. As such, Wilder Sr. pulls the plug on that subsidy, meaning that Van has to figure out a way to pay for his Coolidge life. Because of his living legend status, Van becomes the subject of a series of articles by ...",Tulum film
524,Drama Romance,The plot revolves around a young married woman whose mundane life takes a turn for the worse when she strikes up a passionate and illicit affair with an oddball discount-store stock boy who thinks he's Holden Caulfield.,The Good Girl
525,Comedy Romance,"Benjamin Barry is an advertising executive competing with two female co-workers for a major campaign for a diamond merchant. He cuts a deal with his competitors that the account is his if he can make a woman of their choice fall in love with him in 10 days. In comes Andie Anderson who, in turn, is writing a story on how to lose a guy in 10 days as a bet with her boss to be allowed to write more substantial stories. With a hidden agenda in each camp, will either party be able to complete their mission?",Kako se riješiti frajera u 10 dana
526,Comedy Fantasy Romance,"Nick, a somewhat chauvinistic advertising exec hot shot, has his life turned haywire when a fluke accident enables him to hear what women think. At first all he wants to do is rid himself of this curse, until a wacky psychologist shows him that this could be used to his advantage! His first target is Darcy McGuire, the very woman that got the promotion he wanted. But just as his plan is beginning to work, love gets in the way...",Što žene vole
527,Animation Action Adventure,"In the year 2065, the next great assault against an invading race of phantom-like aliens is about to be launched. Dr. Aki Ross, a brilliant young scientist, races to find the invaders' secrets, not only to save the planet, but herself as well after her body is infected by alien particles. She teams up with the prestigious Deep Eyes military squadron, led by her old friend Grey Edwards. But as Aki, her mentor Dr. Sid, and Grey work toward a peaceful end, the scheming General Hein devises a plot to eradicate the aliens in one swift, destructive blow...even if it destroys the Earth right along with them.",Final Fantasy
528,Comedy Drama Romance,"Jake and Brian are friends. They are Jewish and Catholic respectively. They would grow up and become a rabbi and priest. Anna, whom they knew when they were younger, comes back to town a stunning woman. Jake is up to be the head of his synagogue but he is not married which doesn't make his appointment any easier. Jake finds himself attracted to Anna but because she's not Jewish, he can't marry her as it would make his appointment less likely. Brian also finds himself attracted to Anna, but the priesthood doesn't allow that. Their friendship is strained when each learns of the other's feelings for her.",Keeping the Faith
529,Comedy Crime Fantasy,"Ewan McGregor stars as a cleaning man in Los Angeles, who takes his boss' daughter hostage after being fired and replaced by a robot. Two ""angels"", who are in charge of human relationships on Earth, offer some unsolicited help to bring this unlikely couple together.",A Life Less Ordinary
530,Comedy Romance,None,In & Out
531,Drama Fantasy Romance,"John Travolta plays George Malley, who owns the local auto repair shop in a small California town. After celebrating his birthday with friends at the local bar/hang-out, George heads for home. He pauses to watch a strange light in the sky, then collapses for a few seconds in the middle of the deserted street. In the days and weeks that follow, George finds his IQ and consciousness expanding dramatically, and develops telekinetic abilities. Despite his attempts to explain what has happened to him, with just a very few exceptions, most of the local townspeople treat the ""new"" George as a freak. His state of isolation becomes even more pronounced when his new-found abilities allow him to correctly predict an earthquake, and outside authorities become interested in what's happened to him.",Fenomen
532,Action Romance Thriller,"Ellen, an unknown female gunslinger rides into a small, dingy and depressing prairie town with a secret as to her reason for showing up. Shortly after her arrival, a local preacher, Cort, is thrown through the saloon doors while townfolk are signing up for a gun competition. The pot is a huge sum of money and the only rule: that you follow the rules of the man that set up the contest, Herod. Herod is also the owner, leader, and ""ruler"" of the town. Seems he's arranged this little gun-show-off so that the preacher (who use to be an outlaw and rode with Herod) will have to fight again. Cort refuses to ever use a gun to kill again and Herod, acknowledging Cort as one of the best, is determined to alter this line of thinking ... even if it gets someone killed ...",Brzi i mrtvi
533,Comedy Drama Romance,"Charlie and Muriel Lang have led simple lives for most of their existence. That's until they win $4 million on the lottery. There is a problem, however. Prior to winning the lottery, Charlie had eaten at a café and hadn't been able to tip the waitress. He had promised her, jokingly, that if he won the lottery he'd give her half of it. This is why his wife, Muriel, decides to leave him. She doesn't want the waitress to get a cent of their money. In fact, she wants all $4 million for herself.",Napojnica od 2 milijuna dolara
534,Drama Horror Romance,"In 1794, in the Arctic Sea, Captain Robert Walton is a man obsessed to reach the North Pole, pushing his crew to exhaustion. When his ship hits an iceberg, it is stranded in the ice. Out of the blue, Captain Walton and his men overhear a dreadful cry and they see a stranger coming to the ship. He introduces himself as Victor Frankenstein and he tells the Captain the story of his life since he was a little boy in Geneva. Victor is a barilliant student, and in love with his stepsister Elizabeth, an orphan that was raised by his father Baron Victor von Frankenstein. In 1793, Victor moves to Ingolstadt to study at the university, and he promises to get married to Elizabeth. At the university, Victor befriends Henry Clerval, who becomes his best friend. Victor gets close to Professor Waldman and decides to create life to cheat death, but Waldman advises him that he should not try this experiment, since the result would be an abomination. When Waldman dies, Victor steals his notes and tries...",Frankenstein
535,Action Adventure Comedy,"The three best of the disbanded Musketeers - Athos, Porthos, and Aramis - join a young hotheaded would-be-Musketeer, D'Artagnan, to stop the Cardinal Richelieu's evil plot: to form an alliance with enemy England by way of the mysterious Milady. Rochefort, the Cardinal's right-hand man, announces the official disbanding of the King's Musketeers. Three, however, refuse to throw down their swords - Athos the fighter and drinker, Porthos the pirate and lover, and Aramis the priest and poet. Arriving in Paris to join the Musketeers, D'Artagnan uncovers the Cardinal's plans, and the four set out on a mission to protect King and Country.",The Three Musketeers
536,Comedy Romance,"Charlie, a poet, hasn't had much luck with women, but then he meets Harriet, the girl of his dreams.. or is it his nightmares. Charlie begins to suspect that Harriet is Ms X, a woman who marries then kills her husbands.",So I Married an Axe Murderer
537,Fantasy Romance,"Pete Sandich and buddy Al Yackey are daredevil aerial forest-fire fighters. Pete finds True Love with Dorinda but won't give up the job. When he takes one risk too many, Dorinda faces deep grief and cannot easily put her life back together.",Uvijek
538,Comedy Drama Fantasy,"A 43-year-old mother and housewife who's facing divorce is thrust back in time when she attends her high-school reunion. Given the chance to change the course of her life, she finds herself making many of the same choices.",Peggy Sue Got Married
539,Drama Romance,"Seven friends - Alec, Billy, Jules, Kevin, Kirby, Leslie and Wendy - are trying to navigate through life and their friendships following college graduation. Alec, who aspires to political life, has just shown his true colors by changing his allegiance from Democrat to Republican, which freaks out girlfriend Leslie, who he wants to marry. Budding architect Leslie, on the other hand, has an independent streak. She believes she has to make a name for herself to find out who she is before she can truly commit to another person in marriage. But Leslie and Alec have decided to live together. Because Leslie refuses to marry Alec, he believes that justifies certain behavior. Kirby, who wants to become a lawyer and who pays for his schooling by working as a waiter at their local hangout called St. Elmo's Bar, and struggling writer Kevin are currently roommates. They are on opposite extremes of the romance spectrum. Kirby has just reconnected with Dale Biberman, a slightly older woman he knew ...",St. Elmo's Fire
540,Comedy Fantasy Romance,"Kate and her actor brother live in N.Y. in the 21st Century. Her ex-boyfriend, Stuart, lives above her apartment. Stuart finds a space near the Brooklyn Bridge where there is a gap in time. He goes back to the 19th Century and takes pictures of the place. Leopold -- a man living in the 1870s -- is puzzled by Stuart's tiny camera, follows him back through the gap, and they both ended up in the present day. Leopold is clueless about his new surroundings. He gets help and insight from Charlie who thinks that Leopold is an actor who is always in character. Leopold is a highly intelligent man and tries his best to learn and even improve the modern conveniences that he encounters.",Kate i Leopold
541,Comedy Drama Mystery,"Adapted from the bestselling novel by author John Green, PAPER TOWNS is a coming-of-age story centering on Quentin and his enigmatic neighbor Margo, who loved mysteries so much she became one. After taking him on an all-night adventure through their hometown, Margo suddenly disappears - leaving behind cryptic clues for Quentin to decipher. The search leads Quentin and his quick-witted friends on an exhilarating adventure that is equal parts hilarious and moving. Ultimately, to track down Margo, Quentin must find a deeper understanding of true friendship - and true love.",Gradovi na papiru
542,Drama Romance,"David has had a crush on Jade since the first time he saw her in the tenth grade. With high school coming to an end, David has never spoken to her until her family pulls up to The Inn, where David works as a valet. She and David fall madly in love, a love that only grows stronger as parents try to tear them apart. David knows Jade's past, but as his secrets are slowly revealed, Jade's trust is tested and leaves them wondering if they are truly meant to be together.",Beskrajna ljubav
543,Action Comedy Romance,"After going through a painful break-up, a woman meets a man who appears to be perfect for her. However, as their relationship develops, she learns that he is a former hit-man. Their new, but genuine, relationship is tested even further as they try to save each other, from his dark past which has come back to haunt him.",Mr. Right
544,Comedy Music Romance,"In Rome, the America tourist Hayley meets the local lawyer Michelangelo on the street and soon they fall in love with each other. Hayley's parents, the psychiatrist Phyllis and the retired music producer Jerry, travel to Rome to meet Michelangelo and his parents. When Jerry listens to Michelangelo's father Giancarlo singing opera in the shower, he is convinced that he is a talented opera singer. But there is a problem: Giancarlo can only sing in the shower. The couple Antonio and Milly travel to Rome to meet Antonio's relatives that belong to the high society. Milly goes to the hairdresser while Antonio waits for her in the room. Milly gets lost in Rome and the prostitute Anna mistakenly goes to Antonio's room. Out of the blue, his relatives arrive in the room and they believe Anna is Antonio's wife. Meanwhile the shy Milly meets her favorite actor Luca Salta (Antonio Albanese) and goes to his hotel room ""to discuss about movies"". One day, the middle-class clerk Leopoldo becomes a ...","Rimu, s ljubavlju"
545,Mystery Romance Thriller,"The architect Vincent Stevens; the psychiatrist Chris Vanowen; the real estate agents Luke Seacord and Marty Landry; and Chris' half-brother Philip Trauner are married and best friends. Vincent has designed a brand new building and proposes that he and his friends share one of the wonderful penthouse lofts. This would allow them to hook up with other women without worrying about hotel charges showing up on their credit cards. When they discover the body of a beautiful woman cuffed on the bed in the loft, they argue over whom is responsible and secrets are disclosed affecting their friendship.",Potkrovlje
546,Action Comedy Romance,"Two CIA agents, Tuck and Frank who are also best friends, have been benched because someone's after them. Tuck is divorced with a son whom he's not close to and Frank is a ladies man. Tuck decides to try and find someone so he places his profile on a dating website. Lauren, a woman also looking for a guy sees Tuck's profile and goes with him. She later bumps into Frank and he hits on her and she goes out with him. She's intrigued by both of them. When they learn that they're dating the same girl, they agree to let her choose. But both can't help but use their skills to keep tabs on her and each other. And also sabotage each other's dates with her.",Neka bolji pobijedi
547,Comedy Drama Romance,"Kay and Arnold are a middle-aged couple whose marriage has declined until they are now sleeping in separate rooms and barely interact in any meaningful loving way. Finally, Kay has had enough and finds a book by Dr. Feld which inspires her to sign them up for the Doctor's intense week long marriage counseling session. Although Arnold sees nothing wrong with their 30 year long marriage, he reluctantly agrees to go on the expensive excursion. What follows is an insightful experience as Dr. Feld manages to help the couple understand how they have emotionally drifted apart and what they can do to reignite their passion. Even with the Doctor's advice, Kay and Arnold find that renewing their marriage's fire is a daunting challenge for them both.",Začin za brak
548,Comedy Drama Fantasy,An irreverent young woman who uses her humor to prevent matters from getting serious has a life-changing visit with her doctor.,A Little Bit of Heaven
549,Drama Mystery Romance,"Catherine and David, she a doctor, he a professor, are at first glance the perfect couple. Happily married with a talented teenage son, they appear to have the perfect life. But when David misses a flight and his surprise birthday party, Catherine's long simmering suspicions rise to the surface. Suspecting infidelity, she decides to hire an escort to seduce her husband and test his loyalty. Catherine finds herself 'directing' Chloe's encounters with David, and Chloe's end of the bargain is to report back, the descriptions becoming increasingly graphic as the meetings multiply.",Chloe
550,Comedy Drama Romance,"With John's social life at a standstill and his ex-wife about to get remarried, a down on his luck divorcé finally meets the woman of his dreams, only to discover she has another man in her life - her son. Still single seven years after the breakup of his marriage, John has all but given up on romance. But at the urging of his ex-wife and best friend Jamie, John grudgingly agrees to join her and her fiancé Tim at a party. To his and everyone else's surprise, he actually manages to meet someone: the gorgeous and spirited Molly. Their chemistry is immediate. The relationship takes off quickly but Molly is oddly reluctant to take the relationship beyond John's house. Perplexed, he follows her home and discovers the other man in Molly's life: her son, Cyrus. A 21-year-old new age musician, Cyrus is his mom's best friend and shares an unconventional relationship with her. Cyrus will go to any lengths to protect Molly and is definitely not ready to share her with anyone, especially John. ...",Cyrus
551,Comedy Romance,"Erin has just six more weeks as an intern at the New York Sentinel before she returns to San Francisco. That's fine with Garrett since he just got out of a relationship. But their relationship blossoms and it quickly becomes something that they can't just drop in six weeks. They admit to wanting to be boyfriend/girlfriend just on opposite coasts. The distance wears on them, as with their nay-saying friends and sister, and soon they are forced to either break up or come up with a solution that has them living in the same city.",Ljubav na daljinu
