,genre,storyline,title
0,Action Comedy Crime,"Elwood, the now lone ""Blues Brother"" finally released from prison, is once again enlisted by Sister Mary Stigmata in her latest crusade to raise funds for a children's hospital. Once again hitting the road to re-unite the band and win the big prize at the New Orleans Battle of the Bands, Elwood is pursued cross-country by the cops, led by Cabel the Curtis' son (and Elwood's step-brother), the Russian Mafia, and a militia group. On his new ""mission from God"" Elwood enlists the help of a young orphan, and a strip club bartender.",Braća Blues 2000
1,Comedy Drama Family,"Troy and the gang of East High School are going through their senior year, facing graduating and going their separate ways. Coming to terms with the reality of it all, Troy wants to attend the nearby University of Albuquerque next year on a basketball scholarship, but Gabriella wants to attend Stanford University in California. Meanwhile, Sharpay, the school's shallow and spoiled rich girl, plots to go all out planning the school's final musical show with the idea to add music to her hopes and fears about the future. While Sharpay takes an up-and-coming British exchange student under her wing, her flamboyant fraternal twin brother, Ryan, has his sights set on something different after school. In addition, Troy's best friend and basketball teammate Chad, and Garbiella's best friend Taylor, all have their sights set on their plans after high school and come to terms with the reality of the real world.",High School Musical 3: Maturanti
2,Comedy Family Music,"When the teenager Mary Elizabeth Steppe, a.k.a. Lola, moves with her mother and two younger twin sisters from New York to the suburb of Dellwood, New Jersey, she has the feeling that her cultural and entertaining world ended. While in school, the displaced Lola becomes close friend of the unpopular Ella, who is also a great fan of the her favorite rock band Sidarthur. However, the most popular girl in the school, Carla Santini, disputes the lead role in an adaptation of Pygmalion with Lola and also the leadership of their mates. When the last concert of Sidarthur is sold-out, Lola plans with Ella to travel to New York and buy the tickets from scalpers. However, the girls get into trouble while helping the lead singer and Lola's idol Stu Wolf, changing their lives forever.",Confessions of a Teenage Drama Queen
3,Animation Comedy Family,"After a concert mishap lands Dave in the hospital, Alvin, Simon, and Theodore end up in the care of Dave's twenty-something cousin Toby. When the Chipmunks put aside their stardom to return to school to win a annual ""Battle of the Bands"" competition to save the school's music program. But the boys meet their match with the Chipettes, Brittany, Jeanette, & Eleanor, who are working for the Chipmunks's ex-manager Ian Hawke. Romantic sparks and crazy mishaps happen when the Chipmunks and Chipettes square off.",Alvin and the Chipmunks: The Squeakquel
4,Animation Adventure Comedy,"Playing around while aboard a cruise ship, the Chipmunks and Chipettes accidentally go overboard and end up marooned in a tropical paradise. They discover their new turf is not as deserted as it seems.",Alvin i vjeverice 3
5,Comedy Drama Family,"Miley Stewart is like any other teenage girl. She juggles friends, school and family, but unlike most teenagers, she is secretly a pop star called Hannah Montana. When her popularity starts to take control of her life, her father sends her on a vacation to his hometown in the Tennessee back country, to give her a perspective on what really matters in life.",Hannah Montana: The Movie
6,Drama Music,"YOU GOT SERVED follows the competitive world of street dancing where crews battle each other for money and respect. Elgin and David are best friends and leaders of the best dance crew in the area. When another town's top group challenges them to a battle, David and Elgin, along with their buddies, must create and perfect the most cutting edge moves in order to remain on top. The stakes are raised as friends double-cross each other and true motives are revealed. When the biggest battle comes to town, David and Elgin must work past their differences to prove that they are still the best crew on the streets.",You Got Served
7,Comedy Family Music,"Climb aboard the double decker Spice Bus and get ready for a madcap musical adventure with the sexy phenomenons of pop - the Spice Girls. An encounter with extra-terrestrials, a night in a haunted castle, and a moment of truth in a maternity ward are just a few of the escapades the endeavored upon as the Girls gear up for their first live concert at London's Royal Albert Hall.",Spice World
8,Biography Drama History,"Oskar Schindler is a vainglorious and greedy German businessman who becomes an unlikely humanitarian amid the barbaric German Nazi reign when he feels compelled to turn his factory into a refuge for Jews. Based on the true story of Oskar Schindler who managed to save about 1100 Jews from being gassed at the Auschwitz concentration camp, it is a testament to the good in all of us.",Schindlerova lista
9,Biography Crime Drama,"Henry Hill might be a small time gangster, who may have taken part in a robbery with Jimmy Conway and Tommy De Vito, two other gangsters who might have set their sights a bit higher. His two partners could kill off everyone else involved in the robbery, and slowly start to think about climbing up through the hierarchy of the Mob. Henry, however, might be badly affected by his partners' success, but will he consider stooping low enough to bring about the downfall of Jimmy and Tommy?",Dobri momci
10,Action Biography Drama,None,Dangal
11,Biography Comedy Drama,"In Paris, the aristocratic and intellectual Philippe is a quadriplegic millionaire who is interviewing candidates for the position of his carer, with his red-haired secretary Magalie. Out of the blue, Driss cuts the line of candidates and brings a document from the Social Security and asks Phillipe to sign it to prove that he is seeking a job position so he can receive his unemployment benefit. Philippe challenges Driss, offering him a trial period of one month to gain experience helping him. Then Driss can decide whether he would like to stay with him or not. Driss accepts the challenge and moves to the mansion, changing the boring life of Phillipe and his employees.",Nedodirljivi
12,Biography Drama Music,None,Pijanist
13,Biography Drama History,"William Wallace is a Scottish rebel who leads an uprising against the cruel English ruler Edward the Longshanks, who wishes to inherit the crown of Scotland for himself. When he was a young boy, William Wallace's father and brother, along with many others, lost their lives trying to free Scotland. Once he loses another of his loved ones, William Wallace begins his long quest to make Scotland free once and for all, along with the assistance of Robert the Bruce.",Hrabro srce
14,Biography Drama History,None,Amadeus
15,Adventure Biography Drama,None,Lawrence od Arabije
16,Biography Comedy Drama,"In 1962, Tony ""Tony Lip"" Vallelonga, a tough bouncer, is looking for work when his nightclub is closed for renovations. The most promising offer turns out to be the driver for the African-American classical pianist Don Shirley for a concert tour into the Deep South states. Although hardly enthused at working for a black man, Tony accepts the job and they begin their trek armed with The Negro Motorist Green Book, a travel guide for safe travel through America's racial segregation. Together, the snobbishly erudite pianist and the crudely practical bouncer can barely get along with their clashing attitudes to life and ideals. However, as the disparate pair witness and endure America's appalling injustices on the road, they find a newfound respect for each other's talents and start to face them together. In doing so, they would nurture a friendship and understanding that would change both their lives.",Zelena knjiga: Vodič za zivot
17,Biography Drama Sport,"The true story of the ""Flying Sikh"" - world champion runner and Olympian Milkha Singh -- who overcame the massacre of his family, civil war during the India-Pakistan partition, and homelessness to become one of India's most iconic athletes.",Bhaag Milkha Bhaag
18,Action Biography Crime,"Paan Singh Tomar is a Hindi-language film, based on the true story of a runner employed by the Army and has won Gold medal at Indian National Games but forced to become notorious baaghi. It is directed by Tigmanshu Dhulia.",Paan Singh Tomar
19,Biography Crime Drama,"Jordan Belfort is a Long Island penny stockbroker who served 22 months in prison for defrauding investors in a massive 1990s securities scam that involved widespread corruption on Wall Street and in the corporate banking world, including shoe designer Steve Madden.",Vuk s Wall Streeta
20,Biography Drama History,"In April of 1945, Germany stands at the brink of defeat with the Soviet Armies closing in from the west and south. In Berlin, capital of the Third Reich, Adolf Hitler proclaims that Germany will still achieve victory and orders his Generals and advisers to fight to the last man. ""Downfall"" explores these final days of the Reich, where senior German leaders (such as Himmler and Goring) began defecting from their beloved Fuhrer, in an effort to save their own lives, while still others (Joseph Goebbels) pledge to die with Hitler. Hitler, himself, degenerates into a paranoid shell of a man, full of optimism one moment and suicidal depression the next. When the end finally does comes, and Hitler lies dead by his own hand, what is left of his military must find a way to end the killing that is the Battle of Berlin, and lay down their arms in surrender.",Hitler: Konačni pad
21,Biography Drama,"From the heights of notoriety to the depths of depravity, John Forbes Nash, Jr. experienced it all. A mathematical genius, he made an astonishing discovery early in his career and stood on the brink of international acclaim. But the handsome and arrogant Nash soon found himself on a painful and harrowing journey of self-discovery. After many years of struggle, he eventually triumphed over his tragedy, and finally - late in life - received the Nobel Prize.",Genijalni um
22,Biography Drama Sport,None,Razjareni bik
23,Biography Drama,"Joseph ""John"" Merrick is an intelligent and friendly man, but he is hated by his Victorian-era English society because he is severely deformed. Once he is discovered by a doctor, however, he is saved from his life in a freak show and he is treated like the human being that he really is.",Čovjek slon
24,Adventure Biography Drama,"In the 7th century, Mohammed, Peace Be Upon Him, is visited by Angel Gabriel who urges him to lead the people of Mecca and worship God. But they're exiled in Medina before returning to Mecca to take up arms against their oppressors and liberate their city in the name of God (Allah).",The Message
25,Biography Drama History,"Andreiv Rublev charts the life of the great icon painter through a turbulent period of 15th Century Russian history, a period marked by endless fighting between rival Princes and by Tatar invasions.",Andrei Rublev
26,Biography Drama,"In 1986, Saroo was a five-year-old child in India of a poor but happy rural family. On a trip with his brother, Saroo soon finds himself alone and trapped in a moving decommissioned passenger train that takes him to Calcutta, 1000 miles away from home. Now totally lost in an alien urban environment and too young to identify either himself or his home to the authorities, Saroo struggles to survive as a street child until he is sent to an orphanage. Soon, Saroo is selected to be adopted by the Brierley family in Tasmania, where he grows up in a loving, prosperous home. However, for all his material good fortune, Saroo finds himself plagued by his memories of his lost family in his adulthood and tries to search for them even as his guilt drives him to hide this quest from his adoptive parents and his girlfriend. Only when he has an epiphany does he realize not only the answers he needs, but also the steadfast love that he has always had with all his loved ones in both worlds.",Lav
27,Biography Drama History,None,Greben spašenih
28,Biography Drama History,None,12 godina ropstva
29,Action Biography Drama,None,Utrka života
30,Animation Biography Drama,"In 1970s Iran, Marjane 'Marji' Satrapi watches events through her young eyes and her idealistic family of a long dream being fulfilled of the hated Shah's defeat in the Iranian Revolution of 1979. However as Marji grows up, she witnesses first hand how the new Iran, now ruled by Islamic fundamentalists, has become a repressive tyranny on its own. With Marji dangerously refusing to remain silent at this injustice, her parents send her abroad to Vienna to study for a better life. However, this change proves an equally difficult trial with the young woman finding herself in a different culture loaded with abrasive characters and profound disappointments that deeply trouble her. Even when she returns home, Marji finds that both she and homeland have changed too much and the young woman and her loving family must decide where she truly belongs.",Persepolis
31,Adventure Biography Drama,"Based on a true story. After graduating from Emory University, Christopher McCandless abandoned his possessions, gave his entire savings account to charity, and hitchhiked to Alaska to live in the wilderness. Along the way, Christopher encounters a series of characters who shape his life.",U divljini
32,Biography Drama History,None,Hotel Ruanda
33,Biography Crime Drama,"New Rochelle, the 1960s. High schooler Frank Abagnale Jr. idolizes his father, who's in trouble with the IRS. When his parents separate, Frank runs away to Manhattan with $25 in his checking account, vowing to regain dad's losses and get his parents back together. Just a few years later, the FBI tracks him down in France; he's extradited, tried, and jailed for passing more than $4,000,000 in bad checks. Along the way, he's posed as a Pan Am pilot, a pediatrician, and an attorney. And, from nearly the beginning of this life of crime, he's been pursued by a dour FBI agent, Carl Hanratty. What starts as cat and mouse becomes something akin to father and son.",Uhvati me ako možeš
34,Biography Drama,None,U ime oca
35,Biography Drama History,None,Gandhi
36,Biography Drama,"Tarkovsky mixes flash-backs, historical footage and original poetry to illustrate the reminiscences of a dying man about his childhood during World War II, adolescence, and a painful divorce in his family. The story interweaves reflections about Russian history and society.",Zrcalo
37,Biography Crime Drama,"Butch and Sundance are the two leaders of the Hole-in-the-Wall Gang. Butch is all ideas, Sundance is all action and skill. The west is becoming civilized, and when Butch and Sundance rob a train once too often, a special posse begins trailing them no matter where they run. Over rocks, through towns, across rivers, the group is always just behind them. When they finally escape through sheer luck, Butch has another idea, ""Let's go to Bolivia"". Based on the exploits of the historical characters.",Butch Cassidy i Sundance Kid
38,Biography Drama History,"It's Christmas 1183, and King Henry II (Peter O'Toole) is planning to announce his successor to the throne. The jockeying for the crown, though, is complex. Henry has three sons and wants his boy Prince John (Nigel Terry) to take over. Henry's wife, Queen Eleanor (Katharine Hepburn), has other ideas. She believes their son Prince Richard (Sir Anthony Hopkins) should be King. As the family and various schemers gather for the holiday, each tries to make the indecisive King choose his or her option.",The Lion in Winter
39,Biography Drama History,"Giovanna is taken to the Inquisition court. . After the accusation of blasphemy continues to pray in ecstasy . A friar thinks that Giovanna is a saint, but is taken away by the soldiers. Giovanna sees a cross in the shadow and feels comforted. She is not considered a daughter of God but a daughter of the devil and is sentenced to torture. Giovanna D 'Arco says that even if she dies she will not deny anything. The eyes are twisted by terror in front of the torture wheel and faint. Giovanna is taken to a bed where they are bleeding. Giovanna feels that she is about to die and asks to be buried in a consecrated area. Giovanna burns at the stake while devoted ladies cry.",La passion de Jeanne d'Arc
40,Biography Drama Thriller,"Based on the real life story of legendary cryptanalyst Alan Turing, the film portrays the nail-biting race against time by Turing and his brilliant team of code-breakers at Britain's top-secret Government Code and Cypher School at Bletchley Park, during the darkest days of World War II.",Igra Oponašanja
41,Biography Drama Music,"Bohemian Rhapsody is a foot-stomping celebration of Queen, their music and their extraordinary lead singer Freddie Mercury. Freddie defied stereotypes and shattered convention to become one of the most beloved entertainers on the planet. The film traces the meteoric rise of the band through their iconic songs and revolutionary sound. They reach unparalleled success, but in an unexpected turn Freddie, surrounded by darker influences, shuns Queen in pursuit of his solo career. Having suffered greatly without the collaboration of Queen, Freddie manages to reunite with his bandmates just in time for Live Aid. While bravely facing a recent AIDS diagnosis, Freddie leads the band in one of the greatest performances in the history of rock music. Queen cements a legacy that continues to inspire outsiders, dreamers and music lovers to this day.",Bohemian Rhapsody
42,Action Adventure Biography,"While exploring uncharted wilderness in 1823, legendary frontiersman Hugh Glass sustains injuries from a brutal bear attack. When his hunting team leaves him for dead, Glass must utilize his survival skills to find a way back home while avoiding natives on their own hunt. Grief-stricken and fueled by vengeance, Glass treks through the wintry terrain to track down John Fitzgerald, the former confidant who betrayed and abandoned him.",Povratnik
43,Biography Drama History,None,Kraljev govor
44,Action Biography Drama,"In 1935 in Foshan, south China, there are martial arts schools on every street corner. Ip Man is the undisputed martial arts champion, yet he has not devoted himself to teaching. Despite this, it seems that all the kung fu masters of the city are eager to fight him to improve their reputation.",Priča o Ip Manu
45,Animation Biography Drama,"One night at a bar, an old friend tells director Ari about a recurring nightmare in which he is chased by 26 vicious dogs. Every night, the same number of beasts. The two men conclude that there's a connection to their Israeli Army mission in the first Lebanon War of the early eighties. Ari is surprised that he can't remember a thing anymore about that period of his life. Intrigued by this riddle, he decides to meet and interview old friends and comrades around the world. He needs to discover the truth about that time and about himself. As Ari delves deeper and deeper into the mystery, his memory begins to creep up in surreal images.",Valcer s Bashirom
46,Biography Drama,"Dallas 1985. Electrician and sometimes rodeo bull rider Ron Woodroof lives hard, which includes heavy smoking, drinking, drug use (primarily cocaine) and casual sex. He is racist and homophobic. While in the hospital on a work related injury, the doctors discover and inform him that he is HIV+, and that he will most-likely die within thirty days. Ron is initially in angry denial that he would have a disease that only ""faggots"" have, but upon quick reflection comes to the realization that the diagnosis is probably true. He begins to read whatever research is available about the disease, which at this time seems to be most effectively treated by the drug AZT. AZT, however, is only in the clinical trials stage within the US. Incredulous that he, as a dying man, cannot pay for any drug which may save or at least prolong his life, he goes searching for it by whatever means possible. It eventually leads him to Mexico and a ""Dr."" Vass, an American physician whose license was revoked in the ...",Dobri dileri iz Dallasa
47,Biography Drama,"Based on a true story about a man named Christopher Gardner. Gardner has invested heavily in a device known as a ""bone density scanner"". He feels like he has it made selling these devices. However, they do not sell well as they are marginally better than x-ray at a much higher price. As Gardner works to make ends meet, his wife leaves him and he loses his apartment. Forced to live out in the streets with his son, Gardner continues to sell bone density scanners while concurrently taking on an unpaid internship as a stockbroker, with slim chances for advancement to a paid position. Before he can receive pay, he needs to outshine the competition through 6 months of training, and to sell his devices to stay afloat.",U potrazi za srećom
48,Biography Drama,None,Le scaphandre et le papillon
49,Biography Drama,"Life story of Spaniard Ramón Sampedro, who fought a 30-year campaign to win the right to end his life with dignity. Film explores Ramón's relationships with two women: Julia, a lawyer who supports his cause, and Rosa, a local woman who wants to convince him that life is worth living. Through the gift of his love, these two women are inspired to accomplish things they never previously thought possible. Despite his wish to die, Ramón taught everyone he encountered the meaning, value and preciousness of life. Though he could not move himself, he had an uncanny ability to move others.",Zivot je more
50,Biography Drama Sport,"During the Great Depression, a common-man hero, James J. Braddock--a.k.a. the Cinderella Man--was to become one of the most surprising sports legends in history. By the early 1930s, the impoverished ex-prizefighter was seemingly as broken-down, beaten-up and out-of-luck as much of the rest of the American populace who had hit rock bottom. His career appeared to be finished, he was unable to pay the bills, the only thing that mattered to him--his family--was in danger, and he was even forced to go on Public Relief. But deep inside, Jim Braddock never relinquished his determination. Driven by love, honor and an incredible dose the ones who are do of grit, he willed an impossible dream to come true. In a last-chance bid to help his family, Braddock returned to the ring. No one thought he had a shot. However Braddock, fueled by something beyond mere competition, kept winning. Suddenly, the ordinary working man became the mythic athlete. Carrying the hopes and dreams of the disenfranchised...",Cinderella Man
51,Biography Drama,"""The Straight Story"" chronicles a trip made by 73-year-old Alvin Straight from Laurens, Iowa, to Mt. Zion, Wis., in 1994 while riding a lawn mower. The man undertook his strange journey to mend his relationship with his ill, estranged, 75-year-old brother Lyle.",Prava priča
52,Biography Drama History,None,Svi predsjednikovi ljudi
53,Biography Crime Drama,"Based upon a real-life story that happened in the early seventies in which the Chase Manhattan Bank in Gravesend, Brooklyn, was held siege by a bank robber determined to steal enough money for his wife (a trans woman) to undergo a sex change operation. On a hot summer afternoon, the First Savings Bank of Brooklyn is held up by Sonny and Sal, two down-and-out characters. Although the bank manager and female tellers agree not to interfere with the robbery, Sonny finds that there's actually nothing much to steal, as most of the cash has been picked up for the day. Sonny then gets an unexpected phone call from Police Captain Moretti, who tells him the place is surrounded by the city's entire police force. Having few options under the circumstances, Sonny nervously bargains with Moretti, demanding safe escort to the airport and a plane out of the country in return for the bank employees' safety.",Pasje poslijepodne
54,Biography Crime Drama,None,Leptir
55,Adventure Biography Drama,"A few decades after the destruction of the Inca empire, a Spanish expedition leaves the mountains of Peru and goes down the Amazon river in search of gold and wealth. Soon, they come across great difficulties and Don Aguirres, a ruthless man who cares only about riches, becomes their leader. But will his quest lead them to ""the golden city"", or to certain destruction?","Aguirre, gnjev bozji"
56,Biography Drama War,None,Patton
57,Biography Drama Family,"In 1930's Austria, a young woman named Maria is failing miserably in her attempts to become a nun. When the Navy captain Georg Von Trapp writes to the convent asking for a governess that can handle his seven mischievous children, Maria is given the job. The Captain's wife is dead, and he is often away, and runs the household as strictly as he does the ships he sails on. The children are unhappy and resentful of the governesses that their father keeps hiring, and have managed to run each of them off one by one. When Maria arrives, she is initially met with the same hostility, but her kindness, understanding, and sense of fun soon draws them to her and brings some much-needed joy into all their lives -- including the Captain's. Eventually he and Maria find themselves falling in love, even though Georg is already engaged to a Baroness and Maria is still a postulant. The romance makes them both start questioning the decisions they have made. Their personal conflicts soon become ...","Moje pjesme, moji snovi"
