,genre,storyline,title
151,Biography Drama,"Four Sudanese children are orphaned after their village is massacred in the Second Sudanese Civil War. Consequently, they make an arduous and dangerous trek through the plains, enduring hardship, death and sacrifice all the way until they reach safety in a refugee camp in Kenya. Years later, these youths are among 3600 selected for resettlement in America, only to have the one girl among them sent to Boston, while the three boys must to make a new life in Kansas City. Together, these young men must adjust to an alien culture even as the emotional baggage of their past haunts them. However, these newcomers, and their new friends like employment counselor Carrie Davis, strive to understand each other in this new home, as they make peace with their histories in a challenge that will change all their lives.",The Good Lie
152,Biography Drama Romance,"BELLE is inspired by the true story of Dido Elizabeth Belle (Gugu Mbatha-Raw), the illegitimate mixed race daughter of a Royal Navy Captain. Raised by her aristocratic great-uncle Lord Mansfield (Tom Wilkinson) and his wife (Emily Watson), Belle's lineage affords her certain privileges, yet the color of her skin prevents her from fully participating in the traditions of her social standing. Left to wonder if she will ever find love, Belle falls for an idealistic young vicar's son bent on change who, with her help, shapes Lord Mansfield's role as Lord Chief Justice to end slavery in England.",Belle
153,Biography Drama Sport,"A struggling coach and teacher who has had to move around for different incidents in his career finally comes to one of the poorest cities in America: McFarland, California. There he discovers buried potential in several high school boys and slowly turns them into championship runners and brings them closer than even he could ever imagine.","McFarland, USA"
154,Biography Drama History,"A Biopic on the life of the legendary American Astronaut Neil Armstrong from 1961-1969, on his journey to becoming the first human to walk the moon. Exploring the sacrifices and costs on the Nation and Neil himself, during one of the most dangerous missions in the history of space travel.",Prvi čovjek
155,Biography Comedy Drama,"Inspired by true events, Eddie the Eagle is a feel-good story about Michael ""Eddie"" Edwards (Taron Egerton), an unlikely but courageous British ski-jumper who never stopped believing in himself - even as an entire nation was counting him out. With the help of a rebellious and charismatic coach (played by Hugh Jackman), Eddie takes on the establishment and wins the hearts of sports fans around the world by making an improbable and historic showing at the 1988 Calgary Winter Olympics. From producers of Kingsman: The Secret Service, Eddie the Eagle stars Taron Egerton as Eddie, the loveable underdog with a never say die attitude.",Eddie zvan orao
156,Biography Drama Music,"Brian Wilson is the creative soul of the Beach Boys, but he paid a heavy price for his talent. That especially shows during his peak artistic years in the 1960s, as his inner demons and obsessions trying to please his abusive father drive him to a mental breakdown that would plague him for years. In the 1980s, with Brian barely functional under the domination of the unscrupulous Dr. Landy, Brian meets and falls in love with Melinda Ledbetter. As their relationship grows, she observes Brian's crippling subservience to the abusive psychotherapist with growing alarm. Ultimately, she must take action with a love willing to stand up to oppression she cannot ignore.",Love & Mercy
157,Action Biography Crime,"Germany in the 1970s: Murderous bomb attacks, the threat of terrorism and the fear of the enemy inside are rocking the very foundations of the yet fragile German democracy. The radicalised children of the Nazi generation lead by Andreas Baader, Ulrike Meinhof and Gudrun Ensslin are fighting a violent war against what they perceive as the new face of fascism: American imperialism supported by the German establishment, many of whom have a Nazi past. Their aim is to create a more human society but by employing inhuman means they not only spread terror and bloodshed, they also lose their own humanity. The man who understands them is also their hunter: the head of the German police force Horst Herold. And while he succeeds in his relentless pursuit of the young terrorists, he knows he's only dealing with the tip of the iceberg.",Der Baader Meinhof Komplex
158,Biography Drama History,"In 1865, as the American Civil War winds inexorably toward conclusion, U.S. president Abraham Lincoln endeavors to achieve passage of the landmark constitutional amendment which will forever ban slavery from the United States. However, his task is a race against time, for peace may come at any time, and if it comes before the amendment is passed, the returning southern states will stop it before it can become law. Lincoln must, by almost any means possible, obtain enough votes from a recalcitrant Congress before peace arrives and it is too late. Yet the president is torn, as an early peace would save thousands of lives. As the nation confronts its conscience over the freedom of its entire population, Lincoln faces his own crisis of conscience -- end slavery or end the war.",Lincoln
159,Biography Crime Drama,None,Capote
160,Biography Comedy Drama,"Manchester 1976: Cambridge educated Tony Wilson, Granada TV presenter, is at a Sex Pistols gig. Totally inspired by this pivotal moment in music history, he and his friends set up a record label, Factory Records, signing first Joy Division (who go on to become New Order) then James and the Happy Mondays, who all become seminal artists of their time. What ensues is a tale of music, sex, drugs, larger-than-life characters, and the birth of one of the most famous dance clubs in the world, The Hacienda - a mecca for clubbers as famous as the likes of Studio 54. Graphically depicting the music and dance heritage of Manchester from the late 70's to the early 90's, this comedy documents the vibrancy that made Mad-chester the place in the world that you would most like to be.",24 Hour Party People
161,Biography Drama,"Unable to cope with reality and the difficulty that comes with it, 18 year old Susanna, is admitted to a mental institution in order to overcome her disorder. However, she has trouble understanding her disorder and therefore finds it difficult to tame, especially when she meets the suggestive and unpredictable Lisa.",Prekinuta mladost
162,Biography Comedy Drama,None,Man on the Moon
163,Biography Drama Romance,"""Frida"" chronicles the life Frida Kahlo shared unflinchingly and openly with Diego Rivera, as the young couple took the art world by storm. From her complex and enduring relationship with her mentor and husband to her illicit and controversial affair with Leon Trotsky, to her provocative and romantic entanglements with women, Frida Kahlo lived a bold and uncompromising life as a political, artistic, and sexual revolutionary.",Frida
164,Biography Crime Drama,"Based on the true story of Juliet Hulme and Pauline Parker, two close friends who share a love of fantasy and literature, who conspire to kill Pauline's mother when she tries to end the girls' intense and obsessive relationship.",Heavenly Creatures
165,Biography Drama Thriller,SNOWDEN stars Joseph Gordon-Levitt and is written and directed by Oliver Stone. The script is based on the books The Snowden Files: The Inside Story of the World's Most Wanted Man by Luke Harding and Time of the Octopus by Anatoly Kucherena.,Snowden
166,Adventure Biography Drama,"Twelve people have walked on the moon, but only one man - Philippe Petit (Joseph Gordon-Levitt) - has ever, or will ever, walk in the immense void between the World Trade Center towers. Guided by his real-life mentor, Papa Rudy (Ben Kingsley), and aided by an unlikely band of international recruits, Petit and his gang overcome long odds, betrayals, dissension and countless close calls to conceive and execute their mad plan. Robert Zemeckis, the director of such marvels as Forrest Gump, Cast Away, Back to the Future, Polar Express and Flight, again uses cutting edge technology in the service of an emotional, character-driven story. With innovative photorealistic techniques and IMAX 3D wizardry, The Walk is true big-screen cinema, a chance for moviegoers to viscerally experience the feeling of reaching the clouds. The film, a PG-rated, all-audience entertainment for moviegoers 8 to 80, unlike anything audiences have seen before, is a love letter to Paris and New York City in the 1970s, ...",Put do slave
167,Biography Drama,"The story of the five-day interview between Rolling Stone reporter David Lipsky and acclaimed novelist David Foster Wallace, which took place right after the 1996 publication of Wallace's groundbreaking epic novel, 'Infinite Jest.'",The End of the Tour
168,Biography Drama History,"Maria Altman sought to regain a world famous painting of her aunt plundered by the Nazis during World War II. She did so not just to regain what was rightfully hers, but also to obtain some measure of justice for the death, destruction, and massive art theft perpetrated by the Nazis.",Woman in Gold
169,Action Biography Drama,"Chris Kyle was nothing more than a Texan man who dreamed of becoming a cowboy, but in his thirties he found out that maybe his life needed something different, something where he could express his real talent, something that could help America in its fight against terrorism. So he joined the SEALs in order to become a sniper. After marrying, Kyle and the other members of the team are called for their first tour of Iraq. Kyle's struggle isn't with his missions, but about his relationship with the reality of the war and, once returned at home, how he manages to handle it with his urban life, his wife and kids.",Američki snajper
170,Biography Drama,"Based on the best-selling pair of memoirs from father and son David and Nic Sheff, Beautiful Boy chronicles the heartbreaking and inspiring experience of survival, relapse, and recovery in a family coping with addiction over many years.",Beautiful Boy
171,Biography Drama History,"The film tells the inspiring true story of how Nelson Mandela joined forces with the captain of South Africa's rugby team to help unite their country. Newly elected President Mandela knows his nation remains racially and economically divided in the wake of apartheid. Believing he can bring his people together through the universal language of sport, Mandela rallies South Africa's rugby team as they make their historic run to the 1995 Rugby World Cup Championship match.",Invictus
172,Biography Drama History,"Dominated by her possessive mother and her bullying consort, Conroy, since childhood, teen-aged Victoria refuses to allow them the power of acting as her regent in the last days of her uncle William IV's rule. Her German cousin Albert is encouraged to court her for solely political motives, but, following her accession at age eighteen, finds he is falling for her and is dismayed at her reliance on trusty Prime Minister Melbourne. Victoria is impressed by Albert's philanthropy, which is akin to her own desire to help her subjects. However, her loyalty to Melbourne, perceived as a self-seeker, almost causes a constitutional crisis, and it is Albert who helps restore her self-confidence. She proposes and they marry, Albert proving himself not only a devoted spouse, prepared to take an assassin's bullet for her, but also an agent of much-needed reform, finally endorsed by an admiring Melbourne.",The Young Victoria
173,Biography Crime Drama,"Based on a true story that shocked the nation in 1965, the film recounts one of the most shocking crimes ever committed against a single victim. Sylvia and Jennie Fae Likens, the two daughters of traveling carnival workers are left for an extended stay at the Indianapolis home of single mother Gertrude Baniszewski and her six children. Times are tough, and Gertrude's financial needs cause her to make this arrangement before realizing how the burden will push her unstable nature to a breaking point. What transpires in the next three months is both riveting and horrific.",An American Crime
174,Action Adventure Biography,"In 1965, while bombing Laos in a classified mission, the propeller plane of the German-American US Navy pilot Dieter Dengler is hit and crashes in the jungle. Dieter is arrested by the peasants, tortured by the Vietcong and sent to a prisoner camp, where he meets five other mentally deranged prisoners and guards. He becomes close to Duane and organizes an escape plan; however, the unstable Gene opposes to Dieter's plan. When they discover that there is no more food due to the constant American bombings in the area and their guards intend to kill them, Dieter sets his plan in motion. However, an unexpected betrayal splits the group and Dieter and Duane find that the jungle is their actual prison.",Bijeg u zoru
175,Biography Drama History,None,Kraljica
176,Action Adventure Biography,"The movie is an epic story of a young Genghis Khan and how events in his early life lead him to become a legendary conqueror. The 9-year-old Temüjin is taken on a trip by his father to select a girl as his future wife. He meets Börte, who says she would like to be chosen, which he does. He promises to return after five years to marry her. Temüjin's father is poisoned on the trip, and dies. As a boy Temüjin passes through starvation, humiliations and even slavery, but later with the help of Börte he overcomes all of his childhood hardships to become one of the greatest conquerors the world has ever known.",Mongol
177,Biography Drama Sport,"In 1999, Ken Carter accepts the job of basketball coach for his old high school in a poor area of Richmond, CA. As much dismayed by the poor attitudes of his players as well as their dismal play performance, Carter sets about to change both. He imposes a strict regime typified in written contracts that demand respectful behavior, a dress code and good grades for players. Any initial resistance is soon dispelled as the team under Carter's tutelage becomes a undefeated competitor. However, when the overconfident team's behavior begins to stray with too many doing poorly in class, Carter takes immediate action. To the outrage of the team, the school and the community, Carter cancels all team activities and locks the court until the team shows acceptable academic improvement. In the ensuing debate, Carter fights to keep his methods, determined to show the boys that they need good values for their futures and eventually finds he has affected them more profoundly than he ever expected.",Trener Carter
178,Biography Crime Drama,"The true story of serial killer Aileen Wuornos who was convicted of luring men to their death and eventually executed in 2002. In 1989, she was working as a prostitute and finally makes a friend when she meets and begins a relationship with a young woman, Selby. Determined to straighten out her life, she tries to find legitimate work but with little education and limited social skills, she fails at every turn. She starts working as a hooker hitching rides along the local interstate highway and after robbing a few clients has an encounter with a vicious client whom she kills in self-defense. After that however she just takes to killing clients taking their money and car. Once arrested she claims self-defense but is eventually convicted.",Čudovište
179,Biography Drama,None,Erin Brockovich
180,Biography Drama,"The infamous writer, the Marquis de Sade of eighteenth century France, is imprisoned at Charenton Insane Asylum for unmentionable activities. He manages to befriend the young Abbé de Coulmier, who runs the asylum, along with a beautiful laundress named Madeline. Things go terribly wrong when the Abbe finds out that the Marquis' books are being secretly published. Emperor Napoleon contemplates sending Dr. Royer-Collard to oversee the asylum, a man famed for his torturous punishments. It could mean the end of Charenton and possibly the Marquis.",Otrovno pero Marquisea de Sadea
181,Biography Drama,"A sailor prone to violent outbursts is sent to a naval psychiatrist for help. Refusing at first to open up, the young man eventually breaks down and reveals a horrific childhood. Through the guidance of his doctor, he confronts his painful past and begins a quest to find the family he never knew.",Antwone Fisher
182,Biography Drama,"Larry Flynt is the hedonistically obnoxious, but indomitable, publisher of Hustler magazine. The film recounts his struggle to make an honest living publishing his porn magazine and how it changes into a battle to protect the freedom of speech for all people.",Narod protiv Larryja Flynta
183,Biography Crime Drama,"Film adaptation of street tough Jim Carroll's epistle about his kaleidoscopic free fall into the harrowing world of drug addiction. As a member of a seemingly unbeatable high school basketball squad, Jim's life centers around the basketball court and the court becomes a metaphor for the world in his mind. A best friend who is dying of leukemia, a coach (""Swifty"") who takes unacceptable liberties with the boys on his team, teenage sexual angst, and an unhealthy appetite for heroin -- all of these begin to encroach on young Jim's dream of becoming a basketball star. Soon, the dark streets of New York become a refuge from his mother's mounting concern for her son. He can't go home and his only escape from the reality of the streets is heroin for which he steals, robs and prostitutes himself. Only with the help of Reggie, an older neighborhood friend with whom Jim ""picked up a game"" now and then, is he able to begin the long journey back to sanity.",Dnevnik košarkaša
184,Biography Drama,"In 1957, a son and mother flee the East and an abusive boyfriend to find a new life, and end up in Seattle, where the mother meets a polite garage mechanic. The boy continually gets into trouble by hanging out with the wrong crowd. The mom marries the mechanic, but they soon find out that he's an abusive and unreasoning alcoholic, and they struggle to maintain hope in an impossible situation as the boy grows up with plans to escape the small town by any means possible. Based on a true story by Tobias Wolff.",This Boy's Life
185,Biography Comedy Drama,"A new Disc Jockey is shipped from Crete to Vietnam to bring humor to Armed Forces Radio. He turns the studio on its ear and becomes wildly popular with the troops but runs afoul of the middle management who think he isn't G.I. enough. While he is off the air, he tries to meet Vietnamese especially girls, and begins to have brushes with the real war that never appears on the radio.","Dobro jutro, Vijetname"
186,Biography Comedy Drama,A former wrestler and his family make a living performing at small venues around the country while his kids dream of joining World Wrestling Entertainment.,Fighting with My Family
187,Biography Drama History,"When American military analyst, Daniel Ellsberg, realizes to his disgust the depths of the US government's deceptions about the futility of the Vietnam War, he takes action by copying top-secret documents that would become the Pentagon Papers. Later, Washington Post owner, Kay Graham, is still adjusting to taking over her late husband's business when editor Ben Bradlee discovers the New York Times has scooped them with an explosive expose on those papers. Determined to compete, Post reporters find Ellsberg himself and a complete copy of those papers. However, the Post's plans to publish their findings are put in jeopardy with a Federal restraining order that could get them all indicted for Contempt. Now, Kay Graham must decide whether to back down for the safety of her paper or publish and fight for the Freedom of the Press. In doing so, Graham and her staff join a fight that would have America's democratic ideals in the balance.",Novine
188,Biography Comedy Drama,None,Vice
189,Biography Drama History,None,Osnivač
190,Biography History Thriller,"ANTHROPOID is based on the extraordinary true story of Operation Anthropoid, the World War II mission to assassinate SS General Reinhard Heydrich. The Reich's third in command after Hitler and Himmler, Heydrich was the main architect behind the Final Solution and the leader of occupying Nazi forces in Czechoslovakia whose reign of terror prompted self-exiled Czech and Slovak soldiers (played by Cillian Murphy and Jamie Dornan) to hatch a top-secret mission that would change the face of Europe forever.i",Anthropoid
191,Action Biography Comedy,"Barry Seal was just an ordinary pilot who worked for TWA before he was recruited by the CIA in 1978. His work in South America eventually caught the eye of the Medellín Cartel, associated with Pablo Escobar, who needed a man with his skill set. Barry became a drug trafficker, gun smuggler and money launderer. Soon acquiring the title, 'The gringo that always delivers'.",American Made
192,Adventure Biography Drama,"With the dissolution of her marriage and the death of her mother, Cheryl Strayed has lost all hope. After years of reckless, destructive behavior, she makes a rash decision. With absolutely no experience, driven only by sheer determination, Cheryl hikes more than a thousand miles of the Pacific Crest Trail, alone. Wild powerfully captures the terrors and pleasures of one young woman forging ahead against all odds on a journey that maddens, strengthen, and ultimately heals her.",Divljina
193,Adventure Biography Drama,"A young woman goes on a 1,700-mile trek across the deserts of West Australia with four camels and her faithful dog.",Tracks
194,Biography Drama,"His passion and ingenuity have been the driving force behind the digital age. However his drive to revolutionize technology was sacrificial. Ultimately it affected his family life and possibly his health. In this revealing film we explore the trials and triumphs of a modern day genius, the late CEO of Apple inc. Steven Paul Jobs.",Steve Jobs
195,Biography Comedy Drama,"At the age of 38, Mark O'Brien, a man who uses an iron lung, decides he no longer wishes to be a virgin. With the help of his therapist and his priest, he contacts Cheryl Cohen-Greene, a professional sex surrogate and a typical soccer mom with a house, a mortgage and a husband. Inspired by a true story, The Sessions, follows the fascinating relationship which evolves between Cheryl and Mark as she takes him on his journey to manhood.",Seanse
196,Biography Drama Sport,None,Nesalomljivi
197,Biography Drama Sport,"The inspirational true story of real life surfing phenomenon Jay Moriarity. When 15 year old Jay discovers that the mythic Mavericks surf break, one of the biggest waves on Earth, is not only real, but exists just miles from his Santa Cruz home, he enlists the help of local legend Frosty Hesson to train him to survive it. As Jay and Frosty embark on their quest to accomplish the impossible, they form a unique friendship that transforms both their lives, and their quest to tame Mavericks becomes about far more than surfing.",Surferi
198,Biography Drama,"Cecil Gaines was a sharecropper's son who grew up in the 1920s as a domestic servant for the white family who casually destroyed his. Eventually striking out on his own, Cecil becomes a hotel valet of such efficiency and discreteness in the 1950s that he becomes a butler in the White House itself. There, Cecil would serve numerous US Presidents over the decades as a passive witness of history with the American Civil Rights Movement gaining momentum even as his family has troubles of its own. As his wife, Gloria, struggles with her addictions and his defiant eldest son, Louis, strives for a just world, Cecil must decide whether he should take action in his own way.",Batler
199,Biography Crime Drama,"Betty Anne Waters (Swank) is a high school dropout who spent nearly two decades working as a single mother while putting herself through law school, tirelessly trying to beat the system and overturn her brother's (Rockwell) unjust murder conviction.",Osuda
200,Adventure Biography Drama,"Alexandria, 391 AD: Hypatia teaches astronomy, mathematics, and philosophy. Her student Orestes is in love with her, as is Davus, her personal slave. As the city's Christians, led by Ammonius and Cyril, gain political power, the institutions of learning may crumble along with the governance of slavery. Jump ahead 20 years: Orestes, the city's prefect, has an uneasy peace with the Christians, led by Cyril. A group from the newly empowered Christians has now taken to enforce their cultural hegemony zealously; first they see the Jews as their obstacle, then nonbelievers. Hypatia has no interest in faith; she's concerned about the movement of celestial bodies and ""the brotherhood of all"". Although her former slave doesn't see it that way.",Agora
201,Action Biography Crime,"Inspired by true events, Kathy (Rachel Weisz) is an American police officer who takes a job working as a peacekeeper in post-war Bosnia. Her expectations of helping to rebuild a devastated country are dashed when she uncovers a dangerous reality of corruption, cover-up and intrigue amid a world of private contractors and multinational diplomatic doubletalk.",The Whistleblower
202,Biography Drama History,"The Argentine, begins as Che and a band of Cuban exiles (led by Fidel Castro) reach the Cuban shore from Mexico in 1956. Within two years, they mobilized popular support and an army and toppled the U.S.-friendly regime of dictator Fulgencio Batista.",Che: Part One
