,genre,storyline,title
743,Comedy Romance,"For newlyweds Carl and Molly Peterson, life can't get any sweeter as they begin anew to settle down into married life. With a nice house and established careers in tow, nothing seems to get in their way. However, Carl is about find out just how much friendship means when Dupree, his best friend has been displaced from his home and fired from his job because of attending their wedding. Taking his friend in, what Carl and Molly are about to experience is that the fine line between a few days and whatever else is after, can be a lot more than they bargained for. Especially when their friend overstays his welcome in far too many ways than he should.",Svakog gosta tri dana dosta
744,Comedy Romance,"Early thirty-something dentist Dr. Charlie Logan has never experienced true love, despite having had a number of girlfriends over the years. After an announcement by one of his ex-girlfriends as such at her wedding, Charlie gets a reputation as being a good luck charm. Every woman he has slept with has met and married her dream man immediately following. He is encouraged to exploit this reputation by his long time best friend, Dr. Stu Klaminsky, a sex obsessed, sex starved schlub who became a plastic surgeon just so that he could masturbate over the sight of women's breasts. Charlie doesn't want to be solely a stepping stone for women, which is how they end up treating him once he gains this reputation as a lucky charm, but rather one's true love. He believes the woman of his dreams is accident-prone Cam Wexler, who works as the penguin caretaker at the aquarium. Cam initially doesn't want to date Charlie because of his reputation as a one-night stand type of guy. Charlie in turn ...",Predigra za brak
745,Comedy Romance,"At 35, Tripp has an interesting job, a hip car, a passion for sailing, and a great house - trouble is, he lives with his parents. They want him out, so they hire Paula, an ""interventionist,"" who has a formula in these cases: chance encounter, get him to ask her out, involve him in a trauma, meet his friends and get their nod, delay sex, have him teach her something, then launch him. It's worked up to now, but this gets complicated when Tripp thinks she's getting too serious and one of his pals is attracted to Paula's deadpan, semi-alcoholic roommate, who's plagued by a mockingbird. Too many secrets may scrub the launch, and what if Paula really likes him? Who can intervene then?",Kod kuće je najljepše
746,Comedy Family Romance,"Phil Weston is a goodhearted loser who suffered throughout his childhood due to his competitive overbearing sports coach father, and this has resulted in him inheriting that same attitude, which affects his relationship with his less-than athletic son. When he becomes coach of his son's soccer team, with a poor track record in terms of winning, he strives to beat a rival team, coached by none other than his father.",Kicking & Screaming
747,Action Adventure Biography,"Conquering ninety percent of the known world by the age of twenty-five, Alexander the Great (Colin Farrell) led his armies through twenty-two thousand miles of sieges and conquests in just eight years. Coming out of tiny Macedonia (today part of Greece), Alexander led his armies against the mighty Persian Empire, drove west to Egypt, and finally made his way east to India. This movie concentrated on those eight years of battles, as well as his relationship with his boyhood friend and battle mate, Hephaistion (Jared Leto). Alexander died young, of illness, at the age of thirty-two. Alexander's conquests paved the way for the spread of Greek culture (facilitating the spread of Christianity centuries later), and removed many of the obstacles that might have prevented the expansion of the Roman Empire. In other words, the world we know today might never have been if not for Alexander's bloody, yet unifying, conquest.",Aleksandar Veliki
748,Comedy Romance,"Rosalee Futch is a grocery clerk living in rural West Virginia. But even a small-town girl can have big dreams, and Rosalee's is to someday--somehow--meet her big-screen idol Tad Hamilton. The somehow arrives in the form of a contest--the grand prize: a date with Tad Hamilton--and the someday is now. Rosalee wins, much to the chagrin of her best friend and co-worker Pete, who is deeply, hopelessly--and secretly--in love with Rosalee. The Win a Date contest was cooked up by Tad's agent, Richard Levy, and his manager, also named Richard Levy, to clean up Tad's bad-boy image. Someone should have told them to be careful what you wish for. When Tad meets Rosalee and gets a taste of what he's been missing in the real world, he decides he wants seconds and moves to West Virginia, turning Rosalee's dream come true into a nightmare for Richard Levy, Richard Levy and, most of all, Pete.",Osvoji ljubav
749,Adventure Comedy Romance,"A young man who was born without an immune system and has lived his life within a plastic bubble in his bedroom finds out that the woman he has loved since childhood is about to be married at Niagara Falls, so he builds a portable bubble suit and ventures into the outside world to win her affections.",Bubble Boy
750,Comedy Romance,"Nicole broke up with Matt months ago and is now engaged to someone else. He's very good-looking and has no trouble finding other lovers, but that doesn't help because he's still obsessed with wanting her back. Then he gets the inspiration that swearing off sex for Lent (all forms of sexual activity, even kissing or masturbation) will give him the perspective he needs. So of course a few days later he meets a woman and they fall in love. Now Matt sees his vow as a personal matter, and won't even tell her about it, but his friends think otherwise, and now the complications begin...",40 dana bez komada
751,Comedy Romance Sci-Fi,"Brilliant and obese scientist Sherman Klump invents a miraculous weight-loss solution. After a date with chemistry student Carla Purty goes badly, a depressed Klump tries the solution on himself. Though he instantly loses 250 pounds, the side effects include a second personality: an obnoxiously self-assertive braggart who calls himself Buddy Love. Buddy proves to be more popular than Sherman, but his arrogance and bad behavior quickly spiral out of control.",Luckasti profesor
752,Action Comedy Crime,"Juggling some angry Russians, the British Mi5, his impossibly leggy wife and an international terrorist, debonair art dealer and part-time rogue Charlie Mortdecai must traverse the globe armed only with his good looks and special charm in a race to recover a stolen painting rumored to contain the code to a lost bank account filled with Nazi gold.",Mortdecai
753,Action Romance Thriller,"In the dark world of intelligence and espionage, all information is guarded in the name of national security. But some stories escape the fiercely guarded classified files, stories that become legends. This is one such story, a story that shook the very foundation of this dark world. In a government employees' neighbourhood in New Delhi, there lived a rugged, handsome and mysterious bachelor about whom his neighbours knew nothing. That was because he was India's top spy, an officer with the Research and Analysis Wing (RAW), India's external intelligence agency. This man was known even in official corridors as TIGER (Salman Khan). Tiger is sent on a relatively easy and safe mission to Dublin, Ireland to observe a scientist of Indian origin who is suspected of sharing his research findings with the Pakistan defence establishment. Tiger attempts to meet the scientist but is not successful. He tries to befriend the scientist's part time home caretaker, Zoya (Katrina Kaif). As Tiger begins...",Ek Tha Tiger
754,Action Adventure Drama,"Set in 79 A.D., POMPEII tells the epic story of Milo (Kit Harington), a slave turned invincible gladiator who finds himself in a race against time to save his true love Cassia (Emily Browning), the beautiful daughter of a wealthy merchant who has been unwillingly betrothed to a corrupt Roman Senator. As Mount Vesuvius erupts in a torrent of blazing lava, Milo must fight his way out of the arena in order to save his beloved as the once magnificent Pompeii crumbles around him.",Pompeji
755,Adventure Drama Fantasy,"The final Twilight Saga begins with Bella now a vampire learning to use her abilities. And happy to see her daughter, Renesmee is flourishing. But when someone sees Renesmee do something that makes them think that she was turned. This person goes to the Volturi, because it is a violation to turn a child. And the penalty is death for both who turned the child into a vampire and the child, cause they deem a turned child too dangerous. Alice gets a vision of the Volturi coming after them. So the Cullens try to convince them that Renesmee is not a threat. So they ask friends and family to come stand with them. But when someone who has it in for the Volturi shows up and tells them they should be ready for a fight. And they get ready.",Sumrak saga: Praskozorje - 2. dio
756,Fantasy Horror Mystery,"Valerie (Seyfried) is a beautiful young woman torn between two men. She is in love with a brooding outsider, Peter (Fernandez), but her parents have arranged for her to marry the wealthy Henry (Irons). Unwilling to lose each other, Valerie and Peter are planning to run away together when they learn that Valerie's older sister has been killed by the werewolf that prowls the dark forest surrounding their village. For years, the people have maintained an uneasy truce with the beast, offering the creature a monthly animal sacrifice. But under a blood red moon, the wolf has upped the stakes by taking a human life. Hungry for revenge, the people call on famed werewolf hunter, Father Solomon (Oldman), to help them kill the wolf. But Solomon's arrival brings unintended consequences as he warns that the wolf, who takes human form by day, could be any one of them. As the death toll rises with each moon, Valerie begins to suspect that the werewolf could be someone she loves. As panic grips the ...",Crvenkapica
757,Action Comedy Romance,"In the Dzhugdzhur Mountains, Eastern Siberia, the criminal Dieter Von Cunth steals a Russian X5 nuclear warhead. Colonel James Faith travels to Rio Bamba, Ecuador, with the efficient Lieutenant Dixon Piper to summon the retired special operative MacGruber to retrieve the X5. MacGruber is considered deceased after the death of his beloved wife Casey by his archenemy Cunth in their wedding. MacGruber teams up with Piper and Vicki St. Elmo and they learn that the evil Cunth intends to use the warhead to destroy Washington D.C.",MacGruber
758,Comedy Romance,"It has taken 10 years, two little Fockers with wife Pam, and countless hurdles for Greg to finally get in with his tightly wound father-in-law, Jack. After the cash-strapped dad takes a job moonlighting for a drug company, however, Jack's suspicions about his favorite male nurse come roaring back. When Greg and Pam's entire clan--including Pam's lovelorn ex, Kevin (Owen Wilson)--descends for the twins' birthday party, Greg must prove to the skeptical Jack that he's fully capable as the man of the house. But with all the misunderstandings, spying, and covert missions, will Greg pass Jack's final test and become the family's next patriarch, or will the circle of trust be broken for good?",Dozvola za male Fockere
759,Comedy Romance,"In Manhattan, the lawyer Liv and the school teacher Emma have been best friends since their childhood. They both are proposed to by their boyfriends on the same day and they plan their wedding parties in Plaza Hotel, using the services of the famous Marion St. Claire. However, due to Marion's secretary's mistake, their weddings are scheduled for the same day. None of them agrees to change the date and they become enemies, trying to sabotage the wedding party of the rival.",Rat među nevjestama
760,Comedy Romance,"Finding family. Shelley Darlingson was raised in an orphanage, finally happy when she blossoms into a fox and moves into the Playboy Mansion. Unfortunately, she's summarily expelled on her 27th birthday(she's now too old). In desperation she takes a job as house mother for a sorority of misfits losing their house for lack of members. They have but a few months to find 30 pledges, or a sorority of mean girls will take over their place. Shelley figures that girls will pledge a house that boys find interesting, so she sets out to make the Zetas alluring, not act too smart, and host great parties. Can she succeed, and what about her own makeover? Sabotage is everywhere, plus it's hard to be one's self.",Kućna zečica
761,Comedy Romance,"Slacker Zack Bradley works as a box boy at Super Club, a warehouse club store. It is the lowest in the job hierarchy at the store. He doesn't work very hard at his job, and along with some of his fellow employee friends treats the store like his playground. Regardless, he is well liked by most of the other employees. He used to be hard working, when he was developing a dot com, but he lost all his and his grandmother's money in the process. As such, he decided not to take any risks in life while he now lives with her so as to provide her with what he considers at least a more reliable life. On the other extreme is Vince Downey, who lords an air of superiority over his fellow employees as the store's head cashier. He lives to be the store's best employee solely so that he can be named Employee of the Month, which he has been named seventeen months in a row. If he is named Employee of the Month for a record eighteenth time in a row, he will be rewarded with entrance into the ...",Employee of the Month
762,Comedy Drama Romance,"Hunky NY lawyer Jeff Daly finally got engaged to fickle Sarah Huttinger, who presents him to her Pasadena family, who all soon take to him, for her sister's wedding to Scott. But Jeff's clever counting makes Sarah realize her dad Earl isn't her biological father. Once movie clues from family indicate as suspect successful author Beau Burroughs, she insists on meeting him. Only like her mother and grandmother, she has a one night-stand with Beau, which may well cost her Jeff.","Suska se, suska..."
763,Comedy Family Romance,"Teenager Holly Hamilton is tired of moving every time her single mom Jean has another personal meltdown involving yet another second-rate guy. To distract her mother from her latest bad choice, Holly conceives the perfect plan for the perfect man.. an imaginary secret admirer who will romance Jean and boost her shaky self-esteem. When the virtual relationship takes off, Holly finds herself having to produce the suitor, borrowing her friend's charming and handsome Uncle Ben as the face behind the e-mails, notes and gifts. Holly must resort to increasingly desperate measures to keep the ruse alive and protect her mom's newfound happiness, almost missing the real perfect man when he does come along.",Gospodin savršeni
764,Comedy Romance,"After years of looking for Mr. Right, Charlotte 'Charlie' Cantilini finally finds the man of her dreams, Kevin Fields, only to discover that his mother, Viola, is the woman of her nightmares. A recently fired news anchor who is afraid she will lose her son the way she has just lost her career, Viola determines to scare off her son's new fiancé by becoming the world's worst mother-in-law. While Viola's long-time assistant Ruby does her best to help Viola execute her crazy schemes, Charlie decides to fight back and the gloves come off as the two women battle it out to see just who is the alpha-female.",Za sve je kriva svekrva
765,Adventure Comedy Family,"Teen queen Lizzie McGuire grows up a bit and hits the big screen in this comedy drama, based on the popular Disney Network series. Lizzie McGuire and her best friends Kate, Gordo, and Ethan have just graduated from middle school, and to celebrate, they're taking part in a class trip to Rome, Italy. Eager to celebrate their new maturity as high school students, Lizzie and her pals hope to live it up in one of Europe's most fabled cities, but fate has something more spectacular in store for Lizzie. Lizzie discovers that she bears a striking resemblance to Isabella, an Italian teen-pop idol famous for her duets with heart-throb Paolo -- so much so that when Paolo and Isabella have a falling out, he asks Lizzie to take Isabella's place for an upcoming concert. Lizzie, however, isn't sure she feels comfortable stepping into the spotlight, and is even less sure about the way she feels about Paolo, who makes no secret of his infatuation with her. Things don't get any simpler for Lizzie when ...",Najluđi provod u Europi
766,Comedy Romance,"A happy young couple, Sarah and Tom marry against the wishes of Sarah's friends and family and go to Europe for their honeymoon. Unfortunately for them, Sarah's parents send Sarah's ex-boyfriend Peter Prentis to break up the happy marriage.",Upravo vjencani
767,Action Comedy Fantasy,"For 60 years a mysterious monk with no name has zigzagged the globe to protect an ancient scroll - a scroll that holds the key to unlimited power. Now the Monk must look for a new scrollkeeper. Kar is an unlikely candidate, a streetwise young man whose only interest is himself. But when he inadvertently saves the Bulletproof Monk from capture, the two become partners in a scheme to save the world from the scroll's most avid pursuer. Packed with spectacular special effects and martial arts action, the Monk, Kar, and a sexy Russian mob princess called Bad Girl must struggle to find, face, and fight the ultimate enemy.",Zastitnik
768,Comedy Romance,"Ike Graham has his own by-lined column in USA Today, which he usually uses as a forum to rail against the opposite sex. For his latest column which he writes at the last minute as usual, he, based on some information from a stranger in a bar about a woman he knows of back home, includes the story of still single Hale, Maryland residing Maggie Carpenter, who is known as the ""Runaway Bride"" since she has been engaged multiple times, but always leaves her betrothed standing at the altar. Because an incensed Maggie complains to the newspaper for factual inaccuracies in her story, Ike is fired, but he realizes that the story still has some life in it and thus decides to go to Hale to do further investigation. He finds that Maggie is again engaged, now for the fourth time, this time to high school football coach and adventurist Bob Kelly, who is confident enough in himself to know he will be different than the previous three grooms. When Maggie finds out that her arch enemy Ike is in town, ...",Odbjegla nevjesta
769,Action Adventure Comedy,"Baby George got into a plane crash in a jungle, stayed alive and was adopted by a wise ape. Ursula Stanhope, US noble woman is saved from death on safari by grown-up George, and he takes her to jungle to live with him. He slowly learns a rules of human relationships, while Ursula's lover Lyle is looking for her and the one who took her. After they are found, Ursula takes George to the USA.",George iz dzungle
770,Comedy Romance,"Samuels life is perfect. That is, until he finds out his girlfriend is pregnant. Now he must face the issues that come with being an expecting father, in a most entertaining way.",Nine Months
771,Comedy Romance,"In I FEEL PRETTY a woman who struggles with feelings of deep insecurity and low self-esteem, that hold her back everyday, wakes from a brutal fall in an exercise class believing she is suddenly a supermodel. With this newfound confidence she is empowered to live her life fearlessly and flawlessly, but what will happen when she realizes her appearance never changed?",I Feel Pretty
772,Comedy Drama Romance,"Star softball player, Lisa, has just been cut from the national team; Scholarly business man, George, has just been indicted from his father's company. With everything that they know in their lives taken from them, Lisa and George attempt to find romance. Lisa's potential boyfriend, Matty, however, is as clueless and perpetually single as they come, and George's girlfriend just dumped him. A chance hook-up through mutual friends, Lisa and George may be able to form a friendship, or more, that can help them climb out of the piles of lemons that life has handed to them.",How Do You Know
773,Comedy Drama Romance,"A celebrated military contractor returns to the site of his greatest career triumphs - the US Space program in Honolulu, Hawaii - and reconnects with a long-ago love while unexpectedly falling for the hard-charging Air Force watchdog assigned to him.",Aloha
774,Comedy Romance,"Zoe is a woman who has a hard time letting anyone into her life. She has a habit of pushing people away whenever they get close. She wants to have a baby but because she has no man in her life, she decides to be artificially inseminated. Shortly after having the procedure she meets a guy named Stan, and she feels a spark. When she tells him about her pregnancy, she thinks he'll bail but he sticks with her.",Plan B
775,Action Comedy Romance,"Spencer Aimes is just your average, undercover, government-hired super-assassin accustomed to a life of exotic European locales, flashy sports cars and even flashier women. But when he meets Jen Kornfeldt, a beautiful, fun-loving computer tech recovering from a bad break-up, he finds true love...and happily trades international intrigue for domestic bliss. Three years later, Spencer and Jen are still enjoying a picture-perfect marriage - that is, until the morning after Spencer's 30th birthday. That's when Spencer and Jen learn he's the target of a multi-million dollar hit. Even worse, the hired killers have been stalking the happy couple for years, and could be anyone: friends, neighbors, the grocery store clerk, even that crabby old guy shuffling across the street. Now Spencer and Jen are on the run for their lives. As their suburban paradise turns into a paranoid game of dodge-the-bullet, they must find out who wants Spencer dead and why, all the while trying to save their marriage...",Ubojice
776,Comedy Family Fantasy,"In a dreary Florida beach resort village, luscious-limbed lifeguard Raymond is the main attraction for girls. Teenager buddies Claire and Hailey became experts on him by observation, but never dared actually approach him, and after this closing summer season will be separated as one's parents move to Australia. Then they find a storm washed up in a pool a sassy mermaid, who promises them a wish if they help her prove to Neptune love exists, and Raymond is the only creature resembling a love-god.",Aquamarine
777,Comedy Fantasy Romance,"In Manhattan, Ashley Albright is a lucky woman and very successful in the agency where she works. The clumsy Jake Hardin is an unlucky aspirant manager of the rock band McFly, who is unsuccessfully trying to contact the entrepreneur Damon Phillips to promote his band. When Ashley meets Jake in a masquerade party, they kiss each other, swapping her fortune with his bad luck.",Peh do daske
778,Comedy Romance,"Ben Holmes, a professional book-jacket blurbologist, is trying to get to Savannah for his wedding. He just barely catches the last plane, but a seagull flies into the engine as the plane is taking off. All later flights are cancelled because of an approaching hurricane, so he is forced to hitch a ride in a Geo Metro with an attractive but eccentric woman named Sarah.",Sile prirode
779,Comedy Romance,"On the night of one of their old high school friend's wedding three irresponsible and capricious bridesmaids reunite for one last bachelorette bacchanal in the Big Apple. They unintentionally create a mess of their best friend Becky's wedding dress, before she marries her sweetheart Dale. They attempt to repair the situation by spending the evening before and morning of the wedding desperate to get the dress to Becky on time before the wedding starts, whilst discovering themselves and what they truly want from their lives along the way.",Djeveruše pod gasom
780,Action Comedy Crime,"After losing her job, Jersey girl Stephanie Plum is broke. Needing a job she is told that her cousin, a bail bondsman, needs someone to help out in the office. But the only job openings he has are for skip tracers. She learns that Joe Morelli, a guy she knew intimately years ago, is one of the ""skips"". She eventually finds him but wasn't really prepared so he gets away. Another bounty hunter, Ranger, tries to teach her. Eventually she finds Morelli again, but he claims he is innocent of the crime he is accused of and he is trying to prove his innocence. Eventually Stephanie thinks he's telling the truth so she stakes out the person who can help him. She only finds herself in trouble and Morelli saves her. She tries to find someone who can prove his innocence, but the problem is that shortly after meeting with them they're killed or attacked.",Sve za lovu
781,Drama Romance Thriller,"Lucy is a university student who is working a number of jobs. She volunteers at a research lab, works at a coffee shop, and as a photocopy clerk in an office. She responds to an advertisement and embarks on an erotic freelance job in which she is required to sleep in bed alongside paying customers.",Uspavana ljepotica
