,genre,storyline,title
293,Biography Comedy Drama,"Patch Adams is determined to become a medical doctor because he enjoys helping people. Unfortunately, the medical and scientific community does not appreciate his methods of healing the sick, while the actual patients, medical professors, and hospital nurses all appreciate the work *he* can do, because they are unable to do it.",Patch Adams
294,Biography Comedy Drama,"Having always wanted to be a disc-jockey, Howard Stern works his way painfully from radio at his 1970's college to a Detroit station. It is with a move to Washington that he hits on an outrageous off-the-wall style that catches audience attention. Despite his on-air blue talk, at home he is a loving husband. He needs all the support he can get when he joins NBC in New York and comes up against a very different vision of radio.",Private Parts
295,Action Biography Drama,"Frank Dux has spent most his life being trained by Tanaka to participate in the Kumite, the ultimate martial arts tournament, where participants are seriously injured, even killed. Frank decides to go despite being told by his superiors in the army that he can't because they need him. Two army officers are sent to get him and the trail leads to Hong Kong but Frank eludes them. While Frank advances, he knows that he may have to face Chong Li, the defending champion, who has killed a few participants.",Bloodsport
296,Biography Comedy Drama,None,Battle of the Sexes
297,Action Adventure Biography,"In the pursuit of self-discovery and authentic experiences, the Israeli backpacker, Yossi Ghinsberg, meets a cryptic Austrian geologist in La Paz, Bolivia, and captivated by his engrossing stories of lost tribes, uncharted adventures and even gold, decides to follow him, circa 1981. Without delay and accompanied by the good friends, Kevin, an American photographer, and Marcus, a Swiss teacher, they join an expedition led by their seasoned trail-leader, deep into the emerald and impenetrable Amazonian rainforest. However, as the endless and inhospitable jungle separates the inexperienced team, before long, Yossi will find himself stranded in the depths of a nightmarish environment crawling with formidable and tireless adversaries. How can one escape this green maze?",Jungle
298,Biography Crime Drama,None,"Krajnje izopačen, nepojmljivo zao i opak"
299,Biography Drama History,None,Jackie
300,Biography Comedy Drama,A man working at his parents' motel in the Catskills inadvertently sets in motion the generation-defining concert in the summer of 1969.,Svi na Woodstock
301,Biography Drama,"Several years after leaving the orphanage to which her father never returned for her, Gabrielle Chanel finds herself working in a provincial bar. She's both a seamstress for the performers and a singer, earning the nickname Coco from the song she sings nightly with her sister. A liaison with Baron Balsan gives her an entrée into French society and a chance to develop her gift for designing increasingly popular hats. When she falls in love with English businessman Arthur Capel further opportunities open up, though life becomes ever more complicated.",Coco avant Chanel
302,Biography Drama History,"On January 23, 2002, Wall Street Journal reporter Daniel Pearl is to fly from Karachi to Dubai with his pregnant wife, Mariane, also a reporter. On the day before, with great care, he has arranged an interview in a café with an Islamic fundamentalist cleric. When Danny doesn't return, Mariane initiates a search. Pakistani police, American embassy personnel, and the FBI examine witnesses, phone records, e-mails, and hard drives. Who has him? Where is he? There's also the why: because of U.S. abuse of prisoners at Guantanamo, because of a history of Journal cooperation with the CIA, because Pearl is a Jew? Through it all, Mariane is clearheaded, direct, and determined.",A Mighty Heart
303,Biography Drama Music,"In 2005, the only thing hurting Los Angeles Times columnist Steve Lopez more than his face from a recent bike accident was his pressing need for story ideas. That is when he discovers Nathaniel Ayers, a mentally ill, homeless street musician who possesses extraordinary talent, even through his half-broken instruments. Inspired by his story, Lopez writes an acclaimed series of articles about Ayers and attempts to do more to help both him and the rest of the underclass of LA have a better life. However, Lopez's good intentions run headlong in the hard realities of the strength of Ayers' personal demons and the larger social injustices facing the homeless. Regardless, Lopez and Ayers must find a way to conquer their deepest anxieties and frustrations to hope for a brighter future for both of them.",The Soloist
304,Biography Crime Drama,"NOTORIOUS is the story of Christopher Wallace. Through raw talent and sheer determination, Wallace transforms himself from Brooklyn street hustler (once selling crack to pregnant women) to one of the greatest rappers of all time; THE NOTORIOUS B.I.G. Follow his meteoric rise to fame and his refusal to succumb to expectations - redefining our notion of ""The American Dream.""",Notorious
305,Biography Drama History,"A sumptuous and sensual tale of intrigue, romance and betrayal set against the backdrop of a defining moment in European history: two beautiful sisters, Anne and Mary Boleyn, driven by their family's blind ambition, compete for the love of the handsome and passionate King Henry VIII.",Dvije sestre za kralja
306,Biography Drama History,"Captain Smith is spared his mutinous hanging sentence after captain Newport's ship arrives in 1607 to found Jamestown, an English colony in Virginia. The initially friendly natives, who have no personal property concept, turn hostile after a 'theft' is 'punished' violently on the spot. During an armed exploration, Smith is captured, but spared when the chief's favorite daughter Pocahontas pleads for the stranger who soon becomes her lover and learns to love their naive 'savage' way of harmonious life. Ultimately he returns to the grim fort, which would starve hadn't she arranged for Indian generosity. Alas, each side soon brands their own lover a traitor, so she is banished and he flogged as introduction to slavish toiling. Changes turn again, leading Smith to accept a northern-more mission and anglicized Pocahontas, believing him dead, becoming the mother of aristocratic new lover John Rolfe's son. They'll meet again for a finale in England.",Novi svijet
307,Action Adventure Biography,"Held yearly for centuries, the Ocean of Fire--a 3,000 mile survival race across the Arabian desert--was a challenge restricted to the finest Arabian horses ever bred, the purest and noblest lines, owned by the greatest royal families. In 1890, a wealthy sheik invited an American, Frank T. Hopkins, and his horse to enter the race for the first time. During the course of his career, Hopkins was a cowboy and dispatch rider for the U.S. cavalry--and had once been billed as the greatest rider the West had ever known. The Sheik puts his claim to the test, pitting the American cowboy and his mustang, Hidalgo, against the world's greatest Arabian horses and Bedouin riders--some of whom are determined to prevent a foreigner from finishing the race. For Frank, the Ocean of Fire becomes not only a matter of pride and honor, but a race for his very survival as he and his horse attempt the impossible.",Hidalgo
308,Adventure Biography Crime,Wyatt Earp is a movie about a man and his family. The movie shows us the good times and the bad times of one of the West's most famous individuals.,Wyatt Earp
309,Action Adventure Biography,"Starring Shailene Woodley and Sam Claflin, Adrift is based on the inspiring true story of two free spirits whose chance encounter leads them first to love, and then to the adventure of a lifetime. As the two avid sailors set out on a journey across the ocean, Tami Oldham (Woodley) and Richard Sharp (Claflin) couldn't anticipate they would be sailing directly into one of the most catastrophic hurricanes in recorded history. In the aftermath of the storm, Tami awakens to find Richard badly injured and their boat in ruins. With no hope for rescue, Tami must find the strength and determination to save herself and the only man she has ever loved. Adrift is the unforgettable story about the resilience of the human spirit and the transcendent power of love.",Podivljalo more
310,Biography Comedy Drama,"2003. After careful consideration, Kim Baker, a news copywriter, decides to leave the relative comfort of a New York desk job and serious boyfriend Chris to accept the assignment to work for three months as on-camera reporter in war torn Afghanistan, as her news agency is looking for anyone within their ranks to fill immediately the empty voids overseas. Her only experience of being in such an environment is going through hostile zone training a few years earlier. Immediately upon her arrival in Afghanistan, she realizes that she is ill-prepared emotionally for this assignment, not only enduring the dangers of the war itself, but also the conditions of everyday life, including largely been seen by men as only a ""piece of ass"" and a distraction despite her being considered average looking back home and not being overtly sexual, and being an individual with a small bladder who is nonetheless told to stay hydrated at all times. She is largely assisted in navigating this new life by Tanya...",Whiskey Tango Foxtrot
311,Biography Crime Drama,"Biopic of J. Edgar Hoover told by Hoover as he recalls his career for a biography. Early in his career, Hoover fixated on Communists, anarchists and any other revolutionary taking action against the U.S. government. He slowly builds the agency's reputation, becoming the sole arbiter of who gets hired and fired. One of his hires is Clyde Tolson who is quickly promoted to Assistant Director and would be Hoover's confidant and companion for the rest of Hoover's life. Hoover's memories have him playing a greater role in the many high profile cases the FBI was involved in - the Lindbergh baby kidnapping, the arrest of bank robbers like John Dillinger - and also show him to be quite adept at manipulating the various politicians he's worked with over his career, thanks in large part to his secret files.",J. Edgar
312,Action Biography Drama,"Ip Man's peaceful life in Foshan changes after Gong Yutian seeks an heir for his family in Southern China. Ip Man then meets Gong Er who challenges him for the sake of regaining her family's honor. After the Second Sino-Japanese War, Ip Man moves to Hong Kong and struggles to provide for his family. In the mean time, Gong Er chooses the path of vengeance after her father was killed by Ma San.",Veliki majstor: Ip Man
313,Adventure Biography Drama,"The Lost City of Z tells the incredible true story of British explorer Percy Fawcett, who journeys into the Amazon at the dawn of the 20th century and discovers evidence of a previously unknown, advanced civilization that may have once inhabited the region. Despite being ridiculed by the scientific establishment who regard indigenous populations as ""savages,"" the determined Fawcett - supported by his devoted wife, son and aide de camp returns time and again to his beloved jungle in an attempt to prove his case, culminating in his mysterious disappearance in 1925.",Izgubljeni grad Z
314,Biography Comedy Crime,"Steven Russell is happily married to Debbie, and a member of the local police force when a car accident provokes a dramatic reassessment of his life. Steven becomes open about his homosexuality and decides to live life to the fullest - even if it means breaking the law. Steven's new, extravagant lifestyle involves cons and fraud and, eventually, a stay in the State Penitentiary where he meets sensitive, soft-spoken Phillip Morris. His devotion to freeing Phillip from jail and building the perfect life together prompts Steven to attempt and often succeed at one impossible con after another.","Phillip Morris, volim te"
315,Biography Drama Music,"In 1975, San Fernando Valley teen Joan Larkin reinvents herself as Joan Jett, a guitarist who wants to form an all-girl punk band. She pitches the idea to a sleazy manager, Kim Fowley, who pairs her with a drummer and then searches for a face: he finds Cherie Currie, at age 15, the perfect jailbait image for his purpose; by luck, she can sing. Two others round out the band, The Runaways. Fowley books a tour, signs them to Mercury Records, and packs them off to crowds in Japan. Seeds of conflict sprout early: Fowley puts Cherie front and center in the publicity, she's soon strung out on drugs and vodka, and jealousies arise. Without adult supervision, where can Joan and Cherie end up?",Runaways
316,Biography Drama Romance,"In the early 1940s, Allen Ginsberg is an English major at Columbia University, only to learn more than he bargained for. Dissatisfied by the orthodox attitudes of the school, Allen finds himself drawn to iconoclastic colleagues like Lucien Carr, William S. Burroughs and Jack Kerouac. Together, this gang would explore bold new literary ideas that would challenge the sensibilities of their time as the future Beat Generation. However, for all their creativity, their very appetites and choices lead to more serious transgressions that would mark their lives forever.",Ubij svoje najdraže
317,Biography Comedy Crime,"Mark Whitacre has worked for lysine developing company ADM for many years and has even found his way into upper management. But nothing has prepared him for the job he is about to undertake - being a spy for the FBI. Unwillingly pressured into working as an informant against the illegal price-fixing activities of his company, Whitacre gradually adopts the idea that he's a true secret agent. But as his incessant lies keep piling up, his world begins crashing down around him.",Doušnik!
318,Biography Crime Drama,None,Hollywoodland
319,Biography Comedy Drama,"Seriocomic story based on the memoir by Beverly Donofrio, the movie follows a young woman who finds her life radically altered by an event from her teen years. Born in 1950, Beverly grew up bright and ambitious in a working-class neighborhood in Connecticut; her father was a tough but good-hearted cop who listened to his daughter's problems, and her mother was a nervous woman eager to imagine the worst. From an early age, Beverly displays a keen intelligence and an interest in literature, and dreams of going to college in New York and becoming a writer. However, she also develops an early interest in boys, and at 15 finds herself madly in love with a boy from her high school. However, an attempt to get his attention leads to an embarassing incident at a party, and Ray, a sweet but thick-headed 18-year-old, steps forward to defend her. Beverly and Ray end up making out, and after one thing leads to another, Beverly discovers she's pregnant. Telling Ray is only marginally less difficult...",Riding in Cars with Boys
320,Biography Drama,"Louanne Johnson is an ex-marine, hired as a teacher in a high-school in a poor area of the city. She has recently separated from her husband. Her friend, also teacher in the school, got the temporary job for her. After a terrible reception from the students, she tries unconventional methods of teaching (using karate, Bob Dylan lyrics etc) to gain the trust of the students.",Opasne misli
321,Adventure Biography Drama,"Big budget account of Christopher Columbus' discovery of the Americas. Released in 1992 to celebrate the 500th anniversary of the discovery. Shows the disastrous effects the Europeans had on the original inhabitants, and Columbus' struggle to civilize the New World.",1492: Conquest of Paradise
322,Biography Crime Drama,"At a fast food restaurant, the manager, Sandra, is having a bad day. Suddenly, she gets a phone call from a man claiming to be a police officer who has a complaint that one of her young female employees has stolen from a customer. At the orders of this authoritative sounding stranger, Sandra takes the apparent accused, Becky, to a back room to search her before she is picked up. Once there, the phone scammer manipulates the gullible personnel into participating in Becky's sexual humiliation that grows more twisted with every new sucker on the phone. Only when one final person has the conscience to revolt do they realize the crime they were tricked into, which the real police are hard pressed to solve.",Poslušnost
323,Biography Drama Romance,"Suffering from hysteria, Sabina Spielrein is hospitalized under the care of Dr. Carl Jung who has begun using Dr. Sigmund Freud's talking cure with some of his patients. Spielrain's psychological problems are deeply rooted in her childhood and violent father. She is highly intelligent however and hopes to be a doctor, eventually becoming a psychiatrist in her own right. The married Jung and Spielrein eventually become lovers. Jung and Freud develop an almost father-son relationship with Freud seeing the young Jung as his likely successor as the standard-bearer of his beliefs. A deep rift develops between them when Jung diverges from Freud's belief that while psychoanalysis can reveal the cause of psychological problems it cannot cure the patient.",Opasna metoda
324,Biography Drama,None,Čelična lady
325,Biography Comedy Drama,"Sidney Young is a disillusioned intellectual who both adores and despises the world of celebrity, fame and glamor. His alternative magazine, ""Post Modern Review"", pokes fun at the media obsessed stars and bucks trends, and so when Young is offered a job at the diametrically opposed conservative New York based ""Sharps"" magazine it's something of a shock! It seems ""Sharps"" editor Clayton Harding is amused by Young's disruption of a post-BAFTA party with a pig posing as Babe. Thus begins Sidney's descent into success - his gradual move from derided outsider to confidante of starlet Sophie Maes. Initially helping him out at Sharps is colleague Alison Olsen, who has her own secret. Wither their friendship?",Kako izgubiti prijatelje i otuđiti se od ljudi
326,Biography Drama History,"""All eyes will be on you,"" says the Austrian Empress, Maria Theresa to her youngest daughter Marie Antoinette. The film, marketed for a teen audience, is an impressionistic retelling of Marie Antoinette's life as a young queen in the opulent and eccentric court at Versailles. The film focuses on Marie Antoinette, as she matures from a teenage bride to a young woman and eventual queen of France.",Marija Antoaneta
327,Biography Drama History,"In 1660, with the return of Charles II to the English throne, theater, the visual arts, science and sexual promiscuity flourish. Thirteen years later, in the midst of political and economical problems, Charles II orders the return of his friend John Wilmot, aka the second Earl of Rochester, from exile back to London. John is a morally-corrupt drunkard and a debauched, cynical poet. When the King asks John to prepare a play for the French ambassador so as to please him, John meets the aspiring actress Elizabeth Barry in the playhouse and decides to make her into a great star. He falls in love with her and she becomes his mistress. During the presentation to the King and the French ambassador, John falls into disgrace with the court. When he is thirty-three years old and dying of syphilis and alcoholism, he converts to being a religious man.",Libertine - otrov za zene
328,Adventure Biography Drama,"1429. While the war between France and England (the Hundred Years War) appeared settled in 1420, in England's favour, the death of King Henry V of England reignites it. England occupies large areas of France and appears set to take the whole of it. Into this moment of crisis rides legendary Joan of Arc, a teenage girl who claims to be lead by divine visions.",Ivana Orleanska
329,Biography Comedy Drama,"Oliver Stone's biographical take on the life of George W. Bush, one of the most controversial presidents in USA history, chronicling from his wild and carefree days in college, to his military service, to his governorship of Texas and role in the oil business, his 2000 candidacy for president, his first turbulent four years, and his 2004 re-election campaign.",W.
330,Biography Drama History,"High-flying, adored! The film adaptation of the hit Broadway musical depicting the infamous real-life story of Eva ""Evita"" Duarte de Peron, the wife of President Juan Peron, who rose from poverty to become the most famous Argentine woman in history. Her huge political influence and constant charity works earned her scorn and fear from the military and upper classes but adoration and love from the workers and descamisados. Evita's legendary life is displayed before your eyes as the most hated and most beloved woman in Argentina.",Evita
331,Biography Drama Thriller,"The story begins as WikiLeaks founder Julian Assange (Benedict Cumberbatch) and his colleague Daniel Domscheit-Berg (Daniel Brühl) team up to become underground watchdogs of the privileged and powerful. On a shoestring, they create a platform that allows whistle-blowers to anonymously leak covert data, shining a light on the dark recesses of government secrets and corporate crimes. Soon, they are breaking more hard news than the world's most legendary media organizations combined. But when Assange and Berg gain access to the biggest trove of confidential intelligence documents in U.S. history, they battle each other and a defining question of our time: what are the costs of keeping secrets in a free society-and what are the costs of exposing them?",Tajne petog staleža
332,Biography Drama,None,Lovelace: Život porno kraljice
333,Action Biography Crime,"The daughter of an actor father and a social-climber mother, Domino Harvey, bored with her life, decides to join the team of Ed Moseby and becomes a bounty hunter. But she gets in trouble when the Mafia's money is stolen from an armored truck, while Moseby and his crew are participating in a reality show produced by Mark Heiss. The situation gets out of control when the sons of a rival mobster are kidnapped while the FBI is monitoring two gangs of mobsters.",Domino
334,Biography Drama,"The film opens in 2001 with a middle-aged Steve Jobs (Ashton Kutcher) introducing the iPod at an Apple Town Hall meeting.[6] It then flashes back to Reed College in 1974. Jobs had already dropped out due to the high expense of tuition, but was still attending classes with the approval of Dean Jack Dudman (James Woods) who took him under his wing. Jobs is particularly interested in a course on calligraphy. He meets up with his friend Daniel Kottke (Lukas Haas) who is excited to see that Jobs is holding a copy of Be Here Now by Baba Ram Dass. Influenced by this book and his experiences with LSD, Jobs and Kottke spend time in India. Two years later, Jobs is back in Los Altos, California living at home with his adoptive parents Paul (John Getz) and Clara (Lesley Ann Warren). He is working for Atari and develops a partnership with his friend Steve Wozniak (Josh Gad) after he sees that Wozniak has built a personal computer (the Apple I). They name their new company Apple Computer, though ...",Jobs
335,Action Biography Comedy,"David Ghantt discovers the true meaning of adventure far beyond his wildest dreams. He is an uncomplicated man stuck in a monotonous life. Day in and day out he drives an armored vehicle, transporting millions of other people's money with no escape in sight. The only glimmer of excitement is his flirtatious work crush Kelly Campbell who soon lures him into the scheme of a lifetime. Along with a group of half-brained criminals led by Steve Chambers and an absurdly faulted heist plan, David manages the impossible and makes off with $17 million in cash...only problem is he foolishly hands the money over to this wild group of double crossers and has been set up to take the fall. With the bandits blowing the millions on lavish and ridiculous luxuries, they leave behind a glaring trail of evidence. Now on the lam and in over his head, David must dodge the authorities, evade a hilarious hit man, Mike McKinney, and try to turn the tables on the ones he trusted most.",Genijalni umovi
336,Biography Crime Drama,"Quiet teenager Marc Hall arrives as a new student at Indian Hills High School in Agoura Hills, California. He is befriended by fame-obsessed Rebecca Ahn. While at a party at Rebecca's house, the pair check unlocked vehicles on the street, taking valuables such as cash and credit cards. When Marc mentions that one of his wealthy acquaintances is out of town, Rebecca persuades him to join her in breaking into his house. Rebecca steals a handbag, mentioning that her idol, Lindsay Lohan, has the same one. She also steals cash and the keys to a Porsche, which the pair use to flee the scene. With the cash, the two go on a shopping spree, affording themselves the luxury lifestyle they admire in magazines. Marc visits a nightclub with Rebecca and her friends Nicki Moore, Nicki's adoptive sister Sam, and Chloe Tainer, where they rub shoulders with celebrities such as Kirsten Dunst and Paris Hilton. While researching Hilton on the Internet, Marc and Rebecca realize that she will be out of town....",Bling Ring
