,genre,storyline,title
0,Crime Drama Romance,"Ferdinand Griffon, married to a wealthy Italian wife, has recently been fired from the television station where he worked. His wife forces him to go to a party at the home of her influential father, who wants to introduce him to a potential employer. Her brother brings babysitter Marianne Renoir to take care of their children. Feeling bored at the bourgeois party, Ferdinand borrows his brother-in-law's car to head home. He meets Marianne, who was his mistress five years ago and insists on calling him Pierrot, and offers to take her home. They spend the night together and he learns that she's involved in smuggling weapons. When terrorists chase her, they decide to leave Paris and his family behind and go on the run, on a crazy journey to nowhere.",Ludi Pierrot
1,Drama Horror Mystery,"Melanie Daniels is the modern rich socialite, part of the jet-set who always gets what she wants. When lawyer Mitch Brenner sees her in a pet shop, he plays something of a practical joke on her, and she decides to return the favor. She drives about an hour north of San Francisco to Bodega Bay, where Mitch spends the weekends with his mother Lydia and younger sister Cathy. Soon after her arrival, however, the birds in the area begin to act strangely. A seagull attacks Melanie as she is crossing the bay in a small boat, and then, Lydia finds her neighbor dead, obviously the victim of a bird attack. Soon, birds in the hundreds and thousands are attacking anyone they find out of doors. There is no explanation as to why this might be happening, and as the birds continue their vicious attacks, survival becomes the priority.",Ptice
2,Comedy Drama Romance,"Holly Golightly is a flighty Manhattan party girl, who expects ""money for the powder room as well as for cab fare"" for her companionship. She has even gotten a lucrative once weekly job to visit notorious convict Sally Tomato in Sing Sing, she needing to report back to Sally's lawyer the weather report that Sally tells her as proof of her visits with him in return for payment. Her aspirations for glamour and wealth are epitomized by the comfort she feels at Tiffany's, the famous high-end jewelry retailer where she believes nothing can ever go wrong. Her resolve for this wealth is strengthened, if not changed slightly in focus, upon news from home. Into Holly's walk-up apartment building and thus her life is Paul Varjak, a writer who Holly states reminds her of her brother Fred, who she has not seen in years and who is currently enlisted in the army. The two quickly become friends in their want for something outside of their current lot. Paul's situation is closer to Holly's than he ...",Doručak kod Tiffanyja
3,Comedy Drama Romance,"Linus and David Larrabee are the two sons of a very wealthy family. Linus is all work -- busily running the family corporate empire with no time for a wife and family. David is all play -- technically employed in the family business but never showing up for work, spending all his time entertaining, and having been married and divorced three times. Sabrina Fairchild is the young, shy, and awkward daughter of the household chauffeur, who has been infatuated with David all her life, but whom David hardly notices till she goes away to Paris for two years and returns an elegant, sophisticated, beautiful woman. Suddenly, she finds she's captured David's attention, but just as she does so, she finds herself also falling in love with Linus, and she finds that Linus is also falling in love with her.",Sabrina
4,Drama Romance War,"It's 1941. Robert E. Lee Prewitt has requested Army transfer and has ended up at Schofield in Hawaii. His new captain, Dana Holmes, has heard of his boxing prowess and is keen to get him to represent the company. However, 'Prew' is adamant that he doesn't box anymore, so Captain Holmes gets his subordinates to make his life a living hell. Meanwhile Sergeant Warden starts seeing the captain's wife, who has a history of seeking external relief from a troubled marriage. Prew's friend Maggio has a few altercations with the sadistic stockade Sergeant 'Fatso' Judson, and Prew begins falling in love with social club employee Lorene. Unbeknownst to anyone, the Japanese bombing of Pearl Harbor looms in the distance.",Odavde do vječnosti
5,Drama History Music,"A passionate love story between two people of different backgrounds and temperaments, who are fatefully mismatched and yet condemned to each other. Set against the background of the Cold War in the 1950s in Poland, Berlin, Yugoslavia and Paris, the film depicts an impossible love story in impossible times.",Hladni rat
6,Drama Romance,"This is the story of Kaira, a budding cinematographer in search of perfect life. A chance encounter with Jug, an unconventional thinker, helps her gain new perspective about life. She discovers that happiness is all about finding comfort in life's imperfections.",Dear Zindagi
7,Comedy Drama Romance,"Kumail (Kumail Nanjiani), in the middle of becoming a budding stand-up comedian, meets Emily (Zoe Kazan). Meanwhile, a sudden illness sets in forcing Emily to be put into a medically-induced coma. Kumail must navigate being a comedian, dealing with tragic illness, and placating his family's desire to let them fix him up with a spouse, while contemplating and figuring out who he really is and what he truly believes",Moja ljubavna prica
8,Comedy Drama Romance,"A young coming-of-age tale about a teenage boy, Simon Spier, goes through a different kind of Romeo and Juliet story. Simon has a love connection with a boy, Blue, by email, but the only problem is that Simon has no idea who he's talking to. Simon must discover who that boy is--who Blue is. Along the way, he tries to find himself as well.","S ljubavlju, Simon"
9,Animation Drama Romance,"Takao, who dreams of becoming a shoemaker, skips school and is sketching shoes in a garden in the middle of Tokyo. He meets a mysterious woman, Yukino, who is older than him. Then, without arranging the times, the two start to see each other again and again, but only on rainy days.",Koto no ha no niwa
10,Drama Romance,"The pundit's son Kundan (Dhanush) has fallen for the girl at first sight. That they're both kids makes us dismiss it as a meaningless crush. But a few years later, the boy is still in love with the girl, Zoya (Sonam Kapoor). When she's in school, he follows her around holding her hand and getting slapped in the process. Finally, she relents because of his ""consistency"". The film shifts cities when Zoya gets into JNU (Jawaharlal Nehru University), and through her, we are introduced to the idealistic and political culture of the place. She discovers a long-lost strength as she confronts and then falls for student leader Akram (Abhay Deol). The film takes a turn when Zoya returns to her hometown after eight long years only to find some things changed, and others surprisingly the same.",Raanjhanaa
11,Drama Romance,"On a Friday night after a drunken house party with his straight mates, Russell heads out to a gay club, alone and on the pull. Just before closing time he picks up Glen but what's expected to be just a one-night stand becomes something else, something special. That weekend, in bars and in bedrooms, getting drunk and taking drugs, telling stories and having sex, the two men get to know each other. It is a brief encounter that will resonate throughout their lives. Weekend is both an honest and unapologetic love story between two guys and a film about the universal struggle for an authentic life in all its forms. It is about the search for identity and the importance of making a passionate commitment to your life.",Weekend
12,Drama History Musical,"Jean Valjean, known as Prisoner 24601, is released from prison and breaks parole to create a new life for himself while evading the grip of the persistent Inspector Javert. Set in post-revolutionary France, the story reaches resolution against the background of the June Rebellion.",Jadnici
13,Drama History Romance,None,Jin ling shi san chai
14,Drama Romance,"Anton is a doctor who commutes between his home in an idyllic town in Denmark, and his work at an African refugee camp. In these two very different worlds, he and his family are faced with conflicts that lead them to difficult choices between revenge and forgiveness. Anton and his wife Marianne, who have two young sons, are separated and struggling with the possibility of divorce. Their older, ten-year-old son Elias is being bullied at school, until he is defended by Christian, a new boy who has just moved from London with his father, Claus. Christian's mother recently lost her battle with cancer, and Christian is greatly troubled by her death. Elias and Christian quickly form a strong bond, but when Christian involves Elias in a dangerous act of revenge with potentially tragic consequences, their friendship is tested and lives are put in danger. Ultimately, it is their parents who are left to help them come to terms with the complexity of human emotions, pain and empathy.",U boljem svijetu
15,Comedy Drama Romance,"In Mumbai, Sid Mehra is, in the words of his father, an arrogant, spoiled brat. He lives with a doting mother, subservient brother, and a father who covers his expenses and credit card bills. Sid takes his college finals then starts work at his father's business; he lasts less than a week before walking out. At a graduation party, he meets Aisha, newly arrived from Calcutta and set on becoming a writer. He shows her the city and helps her refurbish a rented flat. He asks if she'd like to progress from friend to something more, but she says no: he lacks ambition and isn't her type. Will her words, his exam results, a confrontation with his parents, and a break with his friends be enough to wake Sid up?",Wake Up Sid
16,Drama Romance,"It's November 30, 1962. Native Brit George Falconer, an English professor at a Los Angeles area college, is finding it difficult to cope with life. Jim, his personal partner of sixteen years, died in a car accident eight months earlier when he was visiting with family. Jim's family were not going to tell George of the death or accident, let alone allow him to attend the funeral. This day, George has decided to get his affairs in order before he will commit suicide that evening. As he routinely and fastidiously prepares for the suicide and post suicide, George reminisces about his life with Jim. But George spends this day with various people, who see a man sadder than usual and who affect his own thoughts about what he is going to do. Those people include Carlos, a Spanish immigrant/aspiring actor/gigolo recently arrived in Los Angeles; Charley, his best friend who he knew from England, she who is a drama queen of a woman who romantically desires her best friend despite his sexual ...",Samac
17,Biography Drama History,"In 1767, the British Princess Caroline is betrothed to the mad King Christian VII of Denmark, but her life with the erratic monarch in the oppressive country becomes an isolating misery. However, Christian soon gains a fast companion with the German Dr. Johann Struensee, a quietly idealistic man of the Enlightenment. As the only one who can influence the King, Struensee is able to begin sweeping enlightened reforms of Denmark through Christian even as Caroline falls for the doctor. However, their secret affair proves a tragic mistake that their conservative enemies use to their advantage in a conflict that threatens to claim more than just the lovers as their victims.",Kraljevska afera
18,Drama Romance,"THE READER opens in post-war Germany when teenager Michael Berg becomes ill and is helped home by Hanna, a stranger twice his age. Michael recovers from scarlet fever and seeks out Hanna to thank her. The two are quickly drawn into a passionate but secretive affair. Michael discovers that Hanna loves being read to and their physical relationship deepens. Hanna is enthralled as Michael reads to her from ""The Odyssey,"" ""Huck Finn"" and ""The Lady with the Little Dog."" Despite their intense bond, Hanna mysteriously disappears one day and Michael is left confused and heartbroken. Eight years later, while Michael is a law student observing the Nazi war crime trials, he is stunned to find Hanna back in his life - this time as a defendant in the courtroom. As Hanna's past is revealed, Michael uncovers a deep secret that will impact both of their lives. THE READER is a story about truth and reconciliation, about how one generation comes to terms with the crimes of another.",Žena kojoj sam čitao
19,Drama Romance,"Haunted by a secret, Ben Thomas looks for redemption by radically transforming the lives of seven people he doesn't know. Once his plan is set, nothing will be able to stop him. At least that's what he thinks. But Ben hadn't planned on falling in love with one of these people and she's the one who will end up transforming him.",Sedam duša
20,Drama History Romance,"Frustrated in his attempts to assassinate Yee, who is an important official in Japanese-ruled Shanghai, Old Wu, who has lost his wife and two sons as well as two women who had attempted to seduce Yee, now recruits Kuang, Mai Tai Tai, and their troupe of drama students from Hong Kong University in yet another attempt to do away with Yee. Mai Tai Tai is chosen to befriend Yee, which she does by posing as the wife of Mak, befriending Yee's wife and her female friends, and then eventually befriending Yee himself. Even though both get together, they do end up going separate ways, only to meet again four years later. This time Mai is all set to entrap Yee at Chandni Chowk Jewellers which is owned by an East Indian man named Khalid Saiduddin. The question does remain: Will she and her troupe succeed?","Pozuda, oprez"
21,Biography Drama Music,"An un-chronological look at the life of the Little Sparrow, Édith Piaf (1915-1963). Her mother is an alcoholic street singer, her father a circus performer, her paternal grandmother a madam. During childhood she lives with each of them. At 20, she's a street singer discovered by a club owner who's soon murdered, coached by a musician who brings her to concert halls, and then quickly famous. Constant companions are alcohol and heartache. The tragedies of her love affair with Marcel Cerdan and the death of her only child belie the words of one of her signature songs, ""Non, je ne regrette rien."" The back and forth nature of the narrative suggests the patterns of memory and association.",Život u ružičastom
22,Action Drama History,"Jodhaa Akbar is a sixteenth century love story about a marriage of alliance that gave birth to true love between a great Mughal Emperor, Akbar and a Rajput princess, Jodhaa. Politically, success knew no bounds for Emperor Akbar, After having secured the Hindu Kush, he furthered his realm by conquest until his empire extended from Afghanistan to the Bay of Bengal, and from the Himalayas to the Godhavari River. Through a shrewd blend of tolerance, generosity and force, Akbar won the allegiance of the Rajputs, the most belligerent Hindus. But little did Akbar know that when he married Jodhaa, a fiery Rajput princess, in order to further strengthen his relations with the Rajputs, he would in turn be embarking upon a new journey - the journey of true love. The daughter of King Bharmal of Amer, Jodhaa resented being reduced to a mere political pawn in this marriage of alliance, and Akbar's biggest challenge now did not merely lie in winning battles, but in winning the love of Jodhaa - a ...",Jodhaa Akbar
23,Drama Mystery Romance,"In late nineteenth century Vienna, renowned illusionist Eisenheim is reunited with the Duchess von Teschen when she is volunteered from the audience to participate in an illusion during one of his performances. Despite having not seen each other in fifteen years when they were teenagers, they almost immediately recognize each other as Eduard Abramovich and Sophie von Teschen, they who had a doomed romance at that time due to their class differences. The Duchess is soon to be wed to the Crown Prince Leopold in what would be for him a marriage solely in pursuit of power: overthrowing his father, the Emperor Leopold, as well as overtaking the Hungarian side of the empire. The Crown Prince is known to use violence against women if it suits his needs or purposes. As such, the Duchess, who realizes that she still loves Eisenheim and he her, can never leave the Crown Prince without it jeopardizing her life. After Eisenheim humiliates the Crown Prince at a private show which results in an ...",Iluzionist
24,Biography Drama Romance,"Marshall, Texas, described by James Farmer, Jr. as ""the last city to surrender after the Civil War,"" is home to Wiley College, where, in 1935-36, inspired by the Harlem Renaissance and his clandestine work as a union organizer, Professor Melvin Tolson coaches the debate team to a nearly-undefeated season that sees the first debate between U.S. students from white and Negro colleges and ends with an invitation to face Harvard University's national champions. The team of four, which includes a female student and a very young James Farmer, is tested in a crucible heated by Jim Crow, sexism, a lynch mob, an arrest and near riot, a love affair, jealousy, and a national radio audience.",The Great Debaters
25,Comedy Drama Fantasy,"Everybody knows that your life is a story. But what if a story was your life? Harold Crick is your average IRS agent: monotonous, boring, and repetitive. But one day this all changes when Harold begins to hear an author inside his head narrating his life. The narrator it is extraordinarily accurate, and Harold recognizes the voice as an esteemed author he saw on TV. But when the narration reveals that he is going to die, Harold must find the author of the story, and ultimately his life, to convince her to change the ending of the story before it is too late.",Otkucaji života
26,Drama Romance Thriller,"From a humble background and with traditional values, Irish Chris Wilton is still struggling financially despite being a recently retired high ranked tennis pro. He has taken a job as a tennis instructor at an upscale London tennis club, although he knows there is a better life for him somewhere down the road. He is befriended by one of his students, wealthy Tom Hewett. Chris starts to date Tom's sister, Chloe Hewett, a girl-next-door type who is immediately attracted to Chris. Chloe quickly knows she wants to marry Chris, and through her businessman father, Alec Hewett, tries to help Chris and their future by getting him an executive job in Alec's company. In his life with the Hewetts, Chris begins to enjoy the finer things in life. Through it all however, Chris cannot help thinking about Nola Rice, a struggling American actress who he meets at the Hewett estate and who is Tom's unofficial fiancée. Nola is vivacious, and she knows the effect she has on men, including Chris. Unlike ...",Završni udarac
27,Action Adventure Drama,"During the reign of the Tang dynasty in China, a secret organization called ""The House of the Flying Daggers"" rises and opposes the government. A police officer called Leo sends officer Jin to investigate a young dancer named Mei, claiming that she has ties to the ""Flying Daggers"". Leo arrests Mei, only to have Jin breaking her free in a plot to gain her trust and lead the police to the new leader of the secret organization. But things are far more complicated than they seem...",Kuća letećih bodeža
28,Comedy Crime Drama,"In this belated sequel to 'The Decline of the American Empire', 50-something Montreal college professor, Remy, learns that he is dying of liver cancer. He decides to make amends meet to his friends and family before he dies. He first tries to made peace with his ex-wife Louise, who asks their estranged son Sebastian, a successful businessman living in London, to come home. Sebastian makes the impossible happen, using his contacts and disrupting the entire Canadian system in every way possible to help his father fight his terminal illness to the bitter end, while he also tries to reunite his former friends, Pierre, Alain, Dominique, Diane, and Claude to see their old friend before he passes on.",Barbarske invazije
29,Comedy Drama Romance,"Against the backdrop of aged has-been rock star Billy Mack's Christmas themed comeback cover of ""Love Is All Around"" which he knows is crap and makes no bones about it much to his manager Joe's chagrin as he promotes the record, several interrelated stories about romantic love and the obstacles to happiness through love for Londoners are presented in the five weeks preceding Christmas. Daniel's wife has just passed away, leaving him to take care of his adolescent stepson Sam by himself. Daniel is uncertain how to deal with Sam and his problems without his wife present, especially in light of a potential budding romance within their household. Juliet and Peter have just gotten married. They believe that Peter's best friend and best man Mark hates Juliet but won't say so to his or her face. Others looking at the situation from the outside believe Mark is jealous of Juliet as he is in love with Peter himself. Jamie, a writer, is taking a writing retreat by himself in rural France ...",Zapravo ljubav
30,Drama Romance,"In 1951, Laura Brown, a pregnant housewife, is planning a party for her husband, but she can't stop reading the novel 'Mrs. Dalloway'. Clarissa Vaughn, a modern woman living in present times is throwing a party for her friend Richard, a famous author dying of AIDS. These two stories are simultaneously linked to the work and life of Virginia Woolf, who's writing the novel mentioned before.",Sati
31,Drama Musical Romance,"Devdas Mukherji is black-listed by his multi-millionaire Zamindar father, Narayan. After completing 10 years of study; Devdas return to his home-town where his family prepares to welcome him but their happiness changes when Devdas prefers to visit his childhood sweetheart, Parvati alias Paro before paying respect to his mother. After so much years Devdas finds he is still the black spot in his father's life especially when he is prevented from marrying Paro who happen to be a lower-caste girl. Eventually time passes with Paro's family arranging her marriage to a much elderly man named Bhuvan Choudhry where she is introduce to Bhuvan's children - who happen to be within her age group. This sadness not only breaks Devdas heart but confines him to alcohol in a big way. Soon Devdas starts to frequent a brothel and catches the eyes of a courtesan named Chandramukhi - step by step Devdas starts to head towards a path of self destruction.",Devdas
32,Drama Musical Romance,"The year is 1899, and Christian, a young English writer, has come to Paris to follow the Bohemian revolution taking hold of the city's drug and prostitute infested underworld. And nowhere is the thrill of the underworld more alive than at the Moulin Rouge, a night club where the rich and poor men alike come to be entertained by the dancers, but things take a wicked turn for Christian as he starts a deadly love affair with the star courtesan of the club, Satine. But her affections are also coveted by the club's patron: the Duke. A dangerous love triangle ensues as Satine and Christian attempt to fight all odds to stay together but a force that not even love can conquer is taking its toll on Satine...",Moulin Rouge
33,Biography Crime Drama,"Based on actual events. Brandon Teena is the popular new guy in a tiny Nebraska town. He hangs out with the guys, drinking, cussing, and bumper surfing, and he charms the young women, who've never met a more sensitive and considerate young man. Life is good for Brandon, now that he's one of the guys and dating hometown beauty Lana; however, he's forgotten to mention one important detail. It's not that he's wanted in another town for GTA and other assorted crimes, but that Brandon Teena was actually born a woman named Teena Brandon. When his best friends make this discovery, Brandon's life is ripped apart.",Dečki nikad ne plaču
34,Comedy Drama Romance,"Åmål is a small insignificant town where nothing ever happens, where the latest trends are out of date when they get there. Young Elin has a bit of a bad reputation when it comes to guys, but the fact is that she is inexperienced in that matter. Another girl in her school, Agnes, is in love with her but is too shy to do anything about it. For a number of reasons, Elin ends up at Agnes' birthday party as the only guest. They have a girl's night out together but after that Elin desperately avoids Agnes, refusing to even consider her own feelings toward Agnes.",Fucking Åmål
35,Drama Romance,"The path of Francesca Johnson's future seems destined when an unexpected fork in the road causes her to question everything she had come to expect from life. While her husband and children are away at the Illinois state fair in the summer of 1965, Robert Kincaid happens turn into the Johnson farm and asks Francesca for directions to Roseman Bridge. Francesca later learns that he was in Iowa on assignment from National Geographic magazine. She is reluctant seeing that he's a complete stranger and then she agrees to show him to the bridges and gradually she talks about her life from being a war-bride from Italy which sets the pace for this bittersweet and all-too-brief romance of her life. Through the pain of separation from her secret love and the stark isolation she feels as the details of her life consume her, she writes her thoughts of the four-day love affair which took up three journals. The journals are found by her children after the lawyer was going over Francesca's will and ...",Mostovi okruga Madison
